1508, 2, F, White, A+, "gastroesophageal reflux disease, schizophrenia, aphasia", "", "", "", "", "", "", "", "", "fever, syncope, lightheadedness, lethargy, unwell"
1509, 20, M, Black or African American, A+, "cirrhosis, suicide attempt, gout", "", "chronic obstructive airway disease, aphasia", "", "", "", "", "", "", "agitation, mental status changes, headache"
1510, 41, F, White, O-, "sepsis (invertebrate), melanoma, paranoia", "", "thrombocytopaenia", "epilepsy", "osteoporosis", "hyperbilirubinemia, asthma, carcinoma breast", "", "", "", "painful swallowing, paresthesia"
1511, 54, F, Some other race, A+, "hiv infections, hypertensive disease, ileus", "bronchitis", "schizophrenia, pneumonia, affect labile", "septicemia", "suicide attempt", "personality disorder, chronic alcoholic intoxication, obesity", "cholecystitis, chronic alcoholic intoxication", "", "", "lethargy"
1512, 68, F, White, O+, "colitis, decubitus ulcer", "hypertension pulmonary", "glaucoma, melanoma", "emphysema pulmonary, pancytopenia", "diverticulosis, kidney disease, malignant neoplasm of prostate", "paranoia, carcinoma breast, infection", "hernia hiatal", "septicemia, influenza, pericardial effusion body substance", "", "numbness of hand, lightheadedness, bradykinesia, urge incontinence"
1513, 17, M, Black or African American, AB-, "benign prostatic hypertrophy", "hypothyroidism", "primary carcinoma of the liver cells", "", "", "", "", "", "", "palpitation"
1514, 28, M, Native Hawaiians or Other Pacific Islander, B+, "lymphoma", "edema pulmonary, gastroesophageal reflux disease", "systemic infection", "adhesion", "", "", "", "", "", "systolic murmur, frail"
1515, 71, F, Black or African American, A+, "hyperbilirubinemia", "cardiomyopathy", "hernia", "suicide attempt, bronchitis, chronic alcoholic intoxication, hypoglycemia", "hiv infections, deglutition disorder, parkinson disease", "effusion pericardial, decubitus ulcer, Alzheimer's disease", "hemorrhoids", "hiv infections", "adenocarcinoma, coronary heart disease", "cushingoid habitus, night sweat, mass of body structure, thicken, food intolerance"
1516, 33, M, Black or African American, B-, "", "mitral valve insufficiency", "paroxysmal dyspnea, degenerative polyarthritis", "hepatitis B, influenza, dependence, manic disorder", "failure heart", "", "", "", "", "decreased body weight"
1517, 56, F, Native American or Alaska Native, AB-, "", "", "hemorrhoids, personality disorder", "spasm bronchial", "failure heart, malignant tumor of colon", "chronic obstructive airway disease, transient ischemic attack, manic disorder", "coronary heart disease, HIV", "", "", "unconscious state, agitation, mass of body structure"
1518, 62, F, Black or African American, B+, "personality disorder, transient ischemic attack, chronic obstructive airway disease", "influenza, malignant neoplasm of lung", "candidiasis", "osteoporosis, candidiasis", "hernia, carcinoma of lung, tonic-clonic epilepsy", "malignant neoplasm of breast, Alzheimer's disease", "", "dementia", "", "dyspnea on exertion, hypokinesia"
1519, 25, M, Two or more races, A-, "edema pulmonary", "thrombus, encephalopathy", "neoplasm", "obesity, kidney disease, transient ischemic attack", "", "", "", "", "", "lethargy, asthenia, hematuria"
1520, 2, F, Black or African American, O-, "melanoma", "", "", "", "", "", "", "", "", "suicidal"
1521, 80, F, Black or African American, AB+, "chronic kidney failure, accident cerebrovascular", "hernia", "neoplasm, malignant neoplasm of lung", "hyperbilirubinemia, tonic-clonic epilepsy, tonic-clonic seizures", "respiratory failure, influenza, psychotic disorder, anxiety state", "influenza, endocarditis, chronic alcoholic intoxication", "sickle cell anemia", "schizophrenia", "gout, upper respiratory infection", "spontaneous rupture of membranes"
1522, 28, M, Native American or Alaska Native, O+, "adenocarcinoma, septicemia", "depressive disorder, pneumothorax", "bipolar disorder, influenza, carcinoma of lung", "pancreatitis", "", "", "", "", "", "jugular venous distention, sweat"
1523, 17, M, Black or African American, A+, "carcinoma", "depression mental, influenza", "obesity morbid", "", "", "", "", "", "", "chest tightness, shortness of breath"
1524, 49, F, Some other race, A+, "", "hepatitis C, transient ischemic attack", "epilepsy", "cholelithiasis, upper respiratory infection, asthma, chronic alcoholic intoxication, tachycardia sinus", "deep vein thrombosis, systemic infection, gout", "migraine disorders, influenza", "", "", "", "tachypnea, poor feeding"
1525, 57, M, White, B-, "hyperbilirubinemia, asthma, tricuspid valve insufficiency", "decubitus ulcer, embolism pulmonary, migraine disorders", "pancytopenia", "pyelonephritis, personality disorder, accident cerebrovascular, asthma", "cholelithiasis, upper respiratory infection, infection", "oral candidiasis", "ketoacidosis diabetic ", "", "", "chill, thicken"
1526, 37, M, Black or African American, AB+, "hypoglycemia, lymphatic diseases, manic disorder", "pneumonia, cholecystitis, suicide attempt", "epilepsy", "diverticulitis, septicemia, delusion", "overload fluid, fibroid tumor, depressive disorder, stenosis aortic valve, gastritis, suicide attempt", "", "", "", "", "blackout, hemodynamically stable, pain"
1527, 36, F, Some other race, O+, "influenza", "parkinson disease, sepsis (invertebrate)", "infection urinary tract, depressive disorder", "chronic kidney failure, anxiety state", "deep vein thrombosis, pneumothorax", "", "", "", "", "lethargy, apyrexial"
1528, 1, F, White, AB-, "gastritis", "", "", "", "", "", "", "", "", "dysarthria, syncope"
1529, 37, F, White, O+, "chronic obstructive airway disease, influenza, ulcer peptic", "ulcer peptic, deglutition disorder", "hernia hiatal, influenza", "migraine disorders, hernia, infection", "neoplasm metastasis, hepatitis C, hemiparesis, confusion", "", "", "", "", "dyspnea"
1530, 51, F, White, B+, "malignant tumor of colon", "pneumothorax", "hyperlipidemia, endocarditis, primary malignant neoplasm", "colitis, neuropathy, hypercholesterolemia", "edema pulmonary, gastritis, sickle cell anemia, cholelithiasis", "chronic alcoholic intoxication", "influenza, malignant tumor of colon, chronic alcoholic intoxication, anxiety state, coronary heart disease", "", "", "agitation, lung nodule, debilitation"
1531, 55, F, Black or African American, AB+, "kidney disease, infection, coronary arteriosclerosis", "paroxysmal dyspnea, asthma", "", "oral candidiasis", "cardiomyopathy, malignant tumor of colon, failure heart", "influenza, schizophrenia, hypercholesterolemia, infection, HIV", "cirrhosis", "", "", "lesion"
1532, 62, F, Native Hawaiians or Other Pacific Islander, B-, "pneumonia aspiration", "benign prostatic hypertrophy", "cholecystitis, depressive disorder", "neutropenia, hepatitis B, gastritis", "influenza, malignant neoplasms", "chronic alcoholic intoxication, carcinoma colon", "kidney disease, coronary heart disease", "insufficiency renal", "", "hematuria, mass of body structure"
1533, 29, F, Black or African American, O+, "gastritis, sepsis (invertebrate)", "aphasia, suicide attempt", "hiv infections, septicemia, pyelonephritis", "infection, influenza, mitral valve insufficiency", "", "", "", "", "", "erythema, difficulty passing urine, prostate tender"
1534, 29, F, Native Hawaiians or Other Pacific Islander, A-, "", "endocarditis", "psychotic disorder, influenza, adenocarcinoma", "oral candidiasis", "", "", "", "", "", "cough, bedridden"
1535, 68, M, Native Hawaiians or Other Pacific Islander, B+, "", "hepatitis B", "septicemia", "primary carcinoma of the liver cells, degenerative polyarthritis, infection urinary tract", "", "osteomyelitis, failure heart, transient ischemic attack, gastroenteritis, bronchitis", "adenocarcinoma, Alzheimer's disease", "ulcer peptic", "", "clonus, wheezing"
1536, 23, F, White, A+, "hypertensive disease, pyelonephritis, pancytopenia", "", "neoplasm metastasis, dependence", "hepatitis C, ulcer peptic, melanoma", "", "", "", "", "", "qt interval prolonged, pleuritic pain"
1537, 51, F, Native American or Alaska Native, B+, "thrombocytopaenia, coronary arteriosclerosis, schizophrenia", "gout", "diabetes, influenza", "hiv infections, migraine disorders, influenza", "primary malignant neoplasm", "failure heart, deglutition disorder, depression mental, hemiparesis, hiv infections, myocardial infarction", "Alzheimer's disease", "", "", "dyspnea on exertion, pain, frothy sputum"
1538, 64, M, Asian, A-, "myocardial infarction, degenerative polyarthritis", "spasm bronchial, infection urinary tract", "manic disorder, lymphoma, diverticulitis", "gastritis", "kidney disease, obesity", "malignant neoplasm of lung, upper respiratory infection, endocarditis, dependence", "chronic kidney failure, insufficiency renal", "spasm bronchial", "", "sweat, orthopnea"
1539, 3, F, Asian, B+, "infection, malignant neoplasms", "", "", "", "", "", "", "", "", "fall, shortness of breath, syncope"
1540, 8, F, Asian, O+, "influenza", "pneumonia aspiration, cellulitis", "", "", "", "", "", "", "", "tachypnea, abdominal tenderness, moan"
1541, 48, M, White, O+, "delirium, hepatitis C", "deep vein thrombosis", "parkinson disease, lymphatic diseases", "failure heart congestive, parkinson disease, influenza, pericardial effusion body substance", "delusion", "hernia, malignant neoplasm of prostate", "", "", "", "nausea, constipation"
1542, 80, F, Asian, AB-, "", "emphysema pulmonary", "kidney failure acute", "candidiasis, carcinoma", "cardiomyopathy, hepatitis", "depressive disorder", "hemorrhoids, influenza, epilepsy, incontinence, hyperlipidemia", "influenza, coronary heart disease", "hemorrhoids, failure heart", "chest tightness, angina pectoris, pain chest, shortness of breath"
1543, 23, M, Asian, A+, "influenza, pyelonephritis", "paroxysmal dyspnea, infection urinary tract", "malignant neoplasms", "septicemia, malignant neoplasms, gastritis", "", "", "", "", "", "myoclonus, spasm, phonophobia"
1544, 46, M, Native Hawaiians or Other Pacific Islander, A+, "gastritis, tachycardia sinus", "stenosis aortic valve, chronic kidney failure", "ileus, carcinoma prostate", "delusion, neutropenia, colitis, gastroenteritis", "carcinoma of lung, chronic obstructive airway disease", "depressive disorder, depression mental, effusion pericardial, malignant tumor of colon, delusion, tachycardia sinus", "", "", "", "polydypsia"
1545, 1, F, White, B+, "pericardial effusion body substance, influenza", "", "", "", "", "", "", "", "", "palpitation"
1546, 6, M, Asian, B+, "kidney disease", "carcinoma colon", "", "", "", "", "", "", "", "productive cough"
1547, 18, M, Native Hawaiians or Other Pacific Islander, B-, "diverticulitis", "hypertension pulmonary, depression mental, epilepsy", "depressive disorder", "", "", "", "", "", "", "cushingoid facies, decreased body weight"
1548, 60, F, Black or African American, O-, "gastroenteritis", "", "cirrhosis, anemia, hypertensive disease", "effusion pericardial, psychotic disorder, aphasia, malignant neoplasm of breast, stenosis aortic valve", "parkinson disease, hypothyroidism", "anxiety state, malignant neoplasm of breast, dependence, malignant tumor of colon", "personality disorder", "", "", "haemorrhage, diarrhea, unresponsiveness, hypotension"
1549, 28, M, Black or African American, O-, "", "hypoglycemia, malignant neoplasm of lung, exanthema", "thrombocytopaenia", "bacteremia, asthma, neoplasm, pericardial effusion body substance, diverticulosis, hiv infections", "", "", "", "", "", "difficulty, unresponsiveness"
1550, 80, M, White, A+, "carcinoma, hiv infections", "", "hepatitis B", "acquired immuno-deficiency syndrome, paranoia", "deglutition disorder, biliary calculus", "upper respiratory infection, gastritis", "paranoia, cholecystitis, neuropathy, failure heart", "bronchitis, tonic-clonic seizures, anxiety state", "anemia, schizophrenia, hepatitis B, hyperlipidemia", "underweight, hallucinations auditory"
1551, 46, F, White, AB-, "parkinson disease", "arthritis", "peripheral vascular disease, neuropathy", "primary malignant neoplasm, HIV", "carcinoma prostate, effusion pericardial", "migraine disorders, pancreatitis", "", "", "", "patient non compliance, abdominal tenderness, poor dentition"
1552, 46, F, Asian, B-, "infection urinary tract", "", "", "gastritis, malignant neoplasm of breast, sickle cell anemia", "obesity", "influenza", "", "", "", "shortness of breath, intoxication, oliguria"
1553, 61, F, Native American or Alaska Native, O-, "cellulitis", "diverticulosis", "arthritis, affect labile, accident cerebrovascular", "bipolar disorder, osteomyelitis, influenza", "coronary heart disease", "fibroid tumor, gastritis", "pneumonia aspiration, hypercholesterolemia, coronary heart disease, sepsis (invertebrate)", "Alzheimer's disease, systemic infection", "", "bruit, dyspnea"
1554, 23, F, Black or African American, O+, "paranoia, hernia hiatal, cirrhosis", "dementia", "sickle cell anemia", "tonic-clonic epilepsy, hiv infections, chronic alcoholic intoxication", "", "", "", "", "", "nightmare, feeling suicidal, intoxication, suicidal, difficulty"
1555, 38, F, Some other race, A+, "malignant tumor of colon, gastroesophageal reflux disease", "osteomyelitis, gout", "hepatitis", "carcinoma breast, gastritis, hepatitis C, Pneumocystis carinii pneumonia", "carcinoma, hepatitis B, edema pulmonary", "", "", "", "", "scleral icterus"
1556, 81, M, Asian, AB-, "diverticulosis", "osteomyelitis", "depression mental, hiv infections", "malignant tumor of colon, carcinoma colon, kidney disease", "obesity morbid, thrombus, manic disorder, myocardial infarction", "overload fluid, Alzheimer's disease", "coronary heart disease, chronic alcoholic intoxication, hypertension pulmonary", "influenza", "carcinoma, gastritis", "pressure chest, sinus rhythm"
1557, 11, F, White, O-, "tachycardia sinus", "suicide attempt", "coronary arteriosclerosis", "", "", "", "", "", "", "consciousness clear, uncoordination, drowsiness, haemorrhage"
1558, 68, M, Black or African American, B-, "exanthema, sepsis (invertebrate), mitral valve insufficiency", "deep vein thrombosis", "hypertension pulmonary", "osteomyelitis, neoplasm", "hepatitis", "primary carcinoma of the liver cells", "Alzheimer's disease, osteomyelitis", "chronic alcoholic intoxication, deglutition disorder, cholecystitis, hernia", "", "hacking cough, fever"
1559, 78, F, Some other race, O+, "", "spasm bronchial", "tonic-clonic epilepsy, upper respiratory infection, infection urinary tract", "infection", "ileus, chronic alcoholic intoxication, obesity morbid", "deep vein thrombosis, coronary heart disease, hiv infections, carcinoma breast, respiratory failure", "tonic-clonic epilepsy, deglutition disorder, diverticulitis", "influenza, mitral valve insufficiency, cholecystitis, failure heart", "spasm bronchial", "abscess bacterial, projectile vomiting"
1560, 57, M, Asian, O-, "deep vein thrombosis, adenocarcinoma", "", "", "encephalopathy, failure heart", "carcinoma of lung, gastritis", "decubitus ulcer", "psychotic disorder, epilepsy, upper respiratory infection, diabetes, failure heart", "", "", "para 2"
1561, 66, F, Black or African American, AB-, "schizophrenia", "gastroenteritis", "overload fluid, cardiomyopathy, lymphoma", "hepatitis C, acquired immuno-deficiency syndrome", "pneumonia, obesity, hepatitis", "coronary heart disease", "chronic obstructive airway disease", "hyperlipidemia, hypertension pulmonary, overload fluid, incontinence", "", "rest pain, sore to touch"
1562, 14, M, Black or African American, AB-, "gout, influenza, tricuspid valve insufficiency", "neoplasm metastasis, dementia, neuropathy", "overload fluid", "", "", "", "", "", "", "lip smacking"
1563, 8, F, Black or African American, B+, "tonic-clonic epilepsy, hernia", "diverticulosis", "", "", "", "", "", "", "", "homelessness"
1564, 64, M, Some other race, A+, "biliary calculus, carcinoma, insufficiency renal", "hepatitis C", "ischemia, sickle cell anemia", "gastritis, osteomyelitis", "", "pneumothorax, coronary heart disease, failure heart", "acquired immuno-deficiency syndrome, pneumothorax, benign prostatic hypertrophy, hiv infections", "acquired immuno-deficiency syndrome, carcinoma prostate", "", "agitation"
1565, 7, M, Asian, O-, "dehydration, epilepsy", "", "", "", "", "", "", "", "", "thicken, ascites"
1566, 49, F, Native Hawaiians or Other Pacific Islander, A+, "", "diverticulitis, spasm bronchial, coronary arteriosclerosis", "failure kidney", "coronary heart disease", "epilepsy, cholelithiasis, anxiety state, carcinoma colon", "failure heart, hypercholesterolemia", "", "", "", "diarrhea, paresthesia"
1567, 58, F, Two or more races, O+, "hernia, endocarditis", "tonic-clonic seizures, encephalopathy", "hepatitis C, hemorrhoids", "failure heart congestive, encephalopathy, acquired immuno-deficiency syndrome", "delirium, malignant neoplasm of breast", "HIV, cholelithiasis", "primary malignant neoplasm, coronary heart disease, accident cerebrovascular, insufficiency renal, failure heart", "", "", "tachypnea, spontaneous rupture of membranes, chill"
1568, 64, M, Black or African American, AB+, "dehydration, hernia", "gastritis, paranoia", "effusion pericardial", "respiratory failure", "gastritis, ileus, chronic alcoholic intoxication", "deep vein thrombosis", "primary malignant neoplasm", "psychotic disorder, carcinoma colon", "", "diarrhea"
1569, 59, M, Native Hawaiians or Other Pacific Islander, AB+, "", "adenocarcinoma", "embolism pulmonary", "dementia, benign prostatic hypertrophy, influenza, fibroid tumor", "carcinoma colon, malignant tumor of colon, chronic alcoholic intoxication, cholecystitis, acquired immuno-deficiency syndrome", "cardiomyopathy", "hernia", "", "", "symptom aggravating factors, hypercapnia"
1570, 26, M, Black or African American, A+, "carcinoma of lung, lymphoma", "pyelonephritis, exanthema", "carcinoma of lung", "delusion, septicemia, embolism pulmonary, primary carcinoma of the liver cells", "", "", "", "", "", "stupor, splenomegaly"
1571, 48, F, White, B+, "pyelonephritis", "tricuspid valve insufficiency", "bipolar disorder, primary carcinoma of the liver cells", "ketoacidosis diabetic , gout, influenza", "diverticulitis, hypercholesterolemia, gastroenteritis, hypothyroidism, acquired immuno-deficiency syndrome", "carcinoma breast, depressive disorder", "", "", "", "apyrexial, vomiting"
1572, 75, M, White, A+, "", "endocarditis, epilepsy", "gastritis", "primary malignant neoplasm, HIV, benign prostatic hypertrophy, delusion, mitral valve insufficiency", "candidiasis, psychotic disorder, effusion pericardial, degenerative polyarthritis, chronic alcoholic intoxication, ischemia", "", "failure heart, bipolar disorder, melanoma, tonic-clonic epilepsy", "depressive disorder", "manic disorder", "apyrexial, snuffle"
1573, 77, F, White, AB+, "influenza, acquired immuno-deficiency syndrome", "", "affect labile, hypertension pulmonary", "gastroenteritis, asthma, psychotic disorder, hypercholesterolemia", "lymphoma, hepatitis C", "anxiety state, ulcer peptic, effusion pericardial, influenza", "hypercholesterolemia", "Alzheimer's disease, thrombus, tonic-clonic seizures", "respiratory failure, tonic-clonic epilepsy", "cushingoid facies, fatigability, stool color yellow"
1574, 51, F, Native American or Alaska Native, AB+, "delirium, thrombocytopaenia", "", "obesity morbid, malignant neoplasm of prostate, osteoporosis", "hemorrhoids", "hernia, carcinoma breast", "incontinence, tonic-clonic seizures", "cardiomyopathy, oral candidiasis, hypothyroidism, peripheral vascular disease, migraine disorders", "", "", "heartburn"
1575, 82, F, Black or African American, AB+, "gastroesophageal reflux disease, hypertensive disease, influenza", "upper respiratory infection, melanoma, pancytopenia", "carcinoma prostate, spasm bronchial", "transient ischemic attack, delirium, chronic obstructive airway disease, dehydration", "manic disorder, infection urinary tract, gastritis", "epilepsy, influenza, bipolar disorder, primary carcinoma of the liver cells", "gastritis", "emphysema pulmonary, decubitus ulcer", "carcinoma prostate, gastritis", "bleeding of vagina, sore to touch, lesion"
1576, 14, F, Asian, AB+, "hypertension pulmonary", "hypothyroidism", "confusion, gastritis", "", "", "", "", "", "", "dizziness, haemorrhage, guaiac positive"
1577, 55, M, White, AB-, "coronary arteriosclerosis", "endocarditis, malignant neoplasm of lung", "schizophrenia", "ischemia", "embolism pulmonary, chronic kidney failure, osteoporosis, dementia", "infection urinary tract, pancytopenia", "gastritis", "", "", "tumor cell invasion, hematuria"
1578, 17, F, Asian, B+, "neoplasm", "psychotic disorder, manic disorder", "spasm bronchial", "", "", "", "", "", "", "pain chest, asthenia"
1579, 47, F, White, B+, "failure heart congestive", "paranoia, malignant neoplasms", "delirium", "Pneumocystis carinii pneumonia, kidney disease, transient ischemic attack, cardiomyopathy", "", "coronary heart disease, Alzheimer's disease", "", "", "", "inappropriate affect, projectile vomiting"
1580, 52, M, White, B-, "kidney disease, gastroenteritis", "mitral valve insufficiency", "hyperbilirubinemia, hernia", "delusion, diabetes, acquired immuno-deficiency syndrome", "hepatitis C, malignant neoplasm of lung", "neutropenia, malignant neoplasm of prostate, personality disorder, influenza", "hiv infections, hyperglycemia, myocardial infarction, anxiety state, affect labile, chronic alcoholic intoxication", "", "", "hypotension, intoxication, dyspnea"
1581, 23, M, White, O+, "chronic kidney failure", "hyperglycemia, chronic kidney failure", "paroxysmal dyspnea, delusion", "spasm bronchial", "", "", "", "", "", "cough, wheezing, decreased stool caliber"
1582, 84, M, Some other race, AB+, "schizophrenia", "bipolar disorder", "hemorrhoids, hypertension pulmonary", "tonic-clonic epilepsy", "lymphoma, paroxysmal dyspnea, insufficiency renal", "manic disorder", "Alzheimer's disease, hypertensive disease", "candidiasis, chronic alcoholic intoxication, hyperbilirubinemia", "pneumonia", "groggy, ascites, abnormally hard consistency"
1583, 85, M, White, B+, "pancreatitis, incontinence", "hypoglycemia, affect labile", "kidney disease, transient ischemic attack, pericardial effusion body substance", "", "hypoglycemia, hiv infections, adenocarcinoma", "systemic infection, depressive disorder", "influenza, hypercholesterolemia", "melanoma, hernia hiatal, primary malignant neoplasm", "hypertensive disease", "overweight"
1584, 59, M, White, A+, "osteomyelitis, infection urinary tract", "primary carcinoma of the liver cells, hemorrhoids", "embolism pulmonary, biliary calculus", "deep vein thrombosis, hiv infections, septicemia, anxiety state", "", "dehydration, degenerative polyarthritis, gastritis, cholecystitis", "", "", "", "sore to touch, stool color yellow"
1585, 22, M, Black or African American, O+, "arthritis, malignant neoplasms", "hernia", "obesity morbid, thrombocytopaenia, arthritis", "", "", "", "", "", "", "hyperacusis, redness"
1586, 10, F, Asian, AB+, "dementia, influenza", "psychotic disorder", "", "", "", "", "", "", "", "shortness of breath, fever"
1587, 71, F, White, B+, "arthritis, manic disorder", "septicemia, dementia", "deglutition disorder, exanthema, paroxysmal dyspnea", "failure heart, carcinoma colon, incontinence", "affect labile, carcinoma colon", "sickle cell anemia, encephalopathy, cholelithiasis, melanoma, cirrhosis, personality disorder", "pancytopenia, psychotic disorder, coronary heart disease", "sickle cell anemia", "hyperlipidemia", "pustule, decreased translucency, pleuritic pain, fever"
1588, 23, M, Native Hawaiians or Other Pacific Islander, AB+, "hepatitis", "primary malignant neoplasm, overload fluid, primary carcinoma of the liver cells", "", "tonic-clonic seizures", "", "", "", "", "", "nausea"
1589, 39, F, White, O+, "diverticulosis, neuropathy, thrombus", "carcinoma prostate", "sickle cell anemia", "", "emphysema pulmonary", "", "", "", "", "diarrhea, sore to touch, stool color yellow"
1590, 18, M, Black or African American, A+, "manic disorder", "cellulitis, adenocarcinoma", "paranoia", "", "", "", "", "", "", "pruritus, fever, pain abdominal"
1591, 58, F, Native Hawaiians or Other Pacific Islander, A+, "tachycardia sinus, hernia", "influenza", "coronary arteriosclerosis, tonic-clonic epilepsy", "tonic-clonic seizures, influenza", "pancreatitis, delirium, sepsis (invertebrate)", "failure heart", "hemorrhoids, carcinoma", "", "", "asthenia, facial paresis, hemiplegia"
1592, 7, F, Two or more races, O+, "", "influenza, failure heart congestive, thrombocytopaenia", "", "", "", "", "", "", "", "syncope, lightheadedness"
1593, 63, M, Black or African American, AB+, "osteoporosis, pneumonia aspiration", "transient ischemic attack, coronary arteriosclerosis", "overload fluid, insufficiency renal", "schizophrenia, exanthema", "malignant neoplasm of lung, obesity morbid", "influenza, carcinoma prostate", "hepatitis", "colitis, failure heart", "", "hoard, sleeplessness, seizure, irritable mood"
1594, 77, F, Native Hawaiians or Other Pacific Islander, B-, "sickle cell anemia, lymphoma, ischemia", "carcinoma colon", "hemorrhoids", "benign prostatic hypertrophy, personality disorder, carcinoma breast", "osteoporosis, pneumothorax, respiratory failure", "Alzheimer's disease, failure heart", "carcinoma breast, paranoia, obesity", "hepatitis B", "influenza, malignant neoplasm of prostate", "gravida 10"
1595, 40, M, Some other race, AB-, "mitral valve insufficiency, transient ischemic attack", "neuropathy", "gastritis", "hypertension pulmonary, obesity", "kidney disease, influenza, failure heart congestive", "", "", "", "", "unresponsiveness, rale"
