715, 14, F, White, B+, "encephalopathy", "", "", "", "", "", "", "", "", "pain, fatigability"
716, 3, F, Native Hawaiians or Other Pacific Islander, O+, "influenza", "", "", "", "", "", "", "", "", "facial paresis"
717, 82, F, Asian, O+, "colitis, septicemia", "chronic obstructive airway disease", "hemiparesis", "exanthema, fibroid tumor", "malignant neoplasm of lung, malignant neoplasm of breast, delirium, insufficiency renal, HIV", "chronic kidney failure, degenerative polyarthritis, neutropenia", "arthritis, chronic kidney failure, ischemia", "tachycardia sinus, lymphatic diseases, affect labile, hypertension pulmonary, psychotic disorder, oral candidiasis", "epilepsy, neutropenia, osteomyelitis", "drowsiness, asymptomatic, angina pectoris"
718, 1, F, White, A+, "failure heart congestive", "", "", "", "", "", "", "", "", "gravida 0, non-productive cough, unhappy"
719, 31, F, White, O+, "oral candidiasis", "hepatitis C, kidney failure acute", "endocarditis", "dementia", "septicemia, neuropathy", "", "", "", "", "pain abdominal, pain"
720, 23, F, Native Hawaiians or Other Pacific Islander, A+, "obesity morbid, pericardial effusion body substance", "fibroid tumor", "", "HIV, manic disorder", "", "", "", "", "", "redness, hepatomegaly, pain"
721, 15, M, Black or African American, B-, "embolism pulmonary", "", "cellulitis, spasm bronchial", "", "", "", "", "", "", "tachypnea, bradycardia, rale, lethargy"
722, 83, F, Asian, B-, "primary carcinoma of the liver cells", "Pneumocystis carinii pneumonia", "epilepsy", "diverticulitis, paranoia", "glaucoma", "carcinoma prostate, depression mental", "glaucoma, kidney disease, influenza, anxiety state, hypertension pulmonary, malignant neoplasms", "ischemia, gastritis", "suicide attempt, dementia", "haemorrhage"
723, 18, M, White, O+, "failure heart congestive", "obesity morbid", "pancreatitis, myocardial infarction", "", "", "", "", "", "", "distended abdomen, burning sensation, lesion"
724, 55, M, Native Hawaiians or Other Pacific Islander, B+, "diverticulitis", "tricuspid valve insufficiency", "carcinoma colon", "hypercholesterolemia, obesity", "Alzheimer's disease", "bronchitis, acquired immuno-deficiency syndrome, delirium, carcinoma prostate", "", "", "", "unhappy"
725, 81, M, White, A+, "benign prostatic hypertrophy, malignant tumor of colon, hemorrhoids", "glaucoma", "anemia, respiratory failure, hemiparesis", "parkinson disease, cholelithiasis, emphysema pulmonary", "Pneumocystis carinii pneumonia", "osteoporosis, tricuspid valve insufficiency, degenerative polyarthritis, thrombus", "adenocarcinoma", "coronary arteriosclerosis", "failure heart, kidney failure acute", "unresponsiveness, lethargy, agitation"
726, 51, F, Asian, A+, "endocarditis", "personality disorder, affect labile", "gastritis, paranoia", "parkinson disease, spasm bronchial", "embolism pulmonary", "emphysema pulmonary, tonic-clonic epilepsy, deep vein thrombosis, malignant neoplasm of breast", "chronic kidney failure, suicide attempt", "", "", "hydropneumothorax, tenesmus, superimposition"
727, 68, F, Black or African American, A+, "neoplasm metastasis, carcinoma colon, septicemia", "", "", "suicide attempt, chronic alcoholic intoxication", "paranoia, hepatitis C", "neoplasm", "gastritis, carcinoma, psychotic disorder", "deep vein thrombosis, hyperlipidemia, carcinoma prostate", "", "chest discomfort, dyspnea, sweat, pressure chest"
728, 1, F, White, B+, "hyperglycemia, malignant neoplasm of lung, depressive disorder", "", "", "", "", "", "", "", "", "mass of body structure, pain chest"
729, 46, M, White, B-, "ketoacidosis diabetic ", "insufficiency renal", "hyperlipidemia, failure heart congestive, tachycardia sinus", "carcinoma prostate", "delirium, embolism pulmonary", "hypoglycemia, infection, stenosis aortic valve", "", "", "", "muscle hypotonia, productive cough, decreased body weight, pleuritic pain, tachypnea"
730, 52, M, Two or more races, O+, "oral candidiasis, tricuspid valve insufficiency", "tachycardia sinus, hemiparesis, asthma", "failure kidney", "degenerative polyarthritis, tricuspid valve insufficiency", "delusion, mitral valve insufficiency, epilepsy, hypercholesterolemia", "ischemia, degenerative polyarthritis", "", "", "", "rhonchus, fever, chill"
731, 46, F, White, O+, "", "Pneumocystis carinii pneumonia, pneumothorax", "encephalopathy, hyperbilirubinemia", "", "pancreatitis, neutropenia, chronic kidney failure, degenerative polyarthritis", "endocarditis, gastroenteritis, influenza", "", "", "", "shortness of breath, cough"
732, 74, F, Native American or Alaska Native, AB+, "encephalopathy, fibroid tumor", "adenocarcinoma, carcinoma", "deglutition disorder, primary carcinoma of the liver cells, degenerative polyarthritis", "fibroid tumor, tricuspid valve insufficiency, melanoma, influenza", "sepsis (invertebrate), hyperbilirubinemia", "tonic-clonic seizures, hypercholesterolemia, carcinoma breast", "ileus, confusion, chronic alcoholic intoxication, hypertension pulmonary, hernia hiatal, upper respiratory infection", "hepatitis, obesity, suicide attempt, Alzheimer's disease", "fibroid tumor, infection urinary tract", "energy increased"
733, 52, F, White, B+, "hepatitis, hyperglycemia", "hernia, deglutition disorder, dehydration", "Pneumocystis carinii pneumonia, embolism pulmonary", "", "malignant tumor of colon, pericardial effusion body substance, hypertensive disease", "anemia, deglutition disorder, pancreatitis", "overload fluid, hemiparesis", "", "", "diarrhea, air fluid level, abdominal tenderness"
734, 7, F, Black or African American, O+, "hernia hiatal, deep vein thrombosis", "asthma, epilepsy, lymphoma", "", "", "", "", "", "", "", "hyperacusis, chill"
735, 51, F, Black or African American, B+, "hypertensive disease", "diverticulitis", "influenza, carcinoma of lung", "ileus", "", "pneumonia, exanthema", "", "", "", "pain chest, bradycardia"
736, 18, F, White, AB+, "obesity morbid", "pancreatitis, peripheral vascular disease, hypertension pulmonary", "diabetes, hypothyroidism, pancreatitis", "", "", "", "", "", "", "dysuria, snuffle, headache"
737, 73, M, Black or African American, AB-, "ileus, aphasia", "osteomyelitis", "overload fluid, depressive disorder", "hyperbilirubinemia, degenerative polyarthritis", "aphasia", "anxiety state, transient ischemic attack, candidiasis, acquired immuno-deficiency syndrome", "tonic-clonic epilepsy, infection", "myocardial infarction, embolism pulmonary, emphysema pulmonary", "hemorrhoids", "paraparesis, apyrexial, nausea"
738, 55, M, Some other race, A+, "", "tonic-clonic epilepsy", "delirium, influenza", "diverticulitis", "thrombus", "ileus", "hypertension pulmonary, melanoma, ulcer peptic, malignant neoplasm of lung, carcinoma, HIV", "", "", "shortness of breath, unsteady gait"
739, 50, M, Native American or Alaska Native, B+, "", "", "hiv infections, delirium, overload fluid", "hypothyroidism", "anxiety state", "degenerative polyarthritis", "", "", "", "pain chest, dizziness"
740, 13, M, Two or more races, B+, "obesity", "influenza, ketoacidosis diabetic , Pneumocystis carinii pneumonia", "diverticulosis", "", "", "", "", "", "", "green sputum, productive cough, malaise"
741, 68, M, White, O+, "influenza, paranoia, primary malignant neoplasm", "pneumonia aspiration", "transient ischemic attack", "infection urinary tract, bronchitis", "", "cirrhosis, confusion, neutropenia, influenza", "bronchitis", "personality disorder", "", "seizure, gurgle, fever"
742, 74, M, Native American or Alaska Native, AB+, "failure heart congestive, edema pulmonary", "malignant neoplasm of lung", "hypoglycemia", "acquired immuno-deficiency syndrome", "coronary heart disease, osteoporosis, pneumothorax", "edema pulmonary", "gastroenteritis", "acquired immuno-deficiency syndrome", "cellulitis, exanthema, hypertension pulmonary", "vomiting, hemodynamically stable, nausea"
743, 32, F, White, A-, "hernia", "", "pneumonia aspiration", "adhesion, upper respiratory infection", "failure heart, HIV", "", "", "", "", "hyperhidrosis disorder"
744, 75, M, Asian, B+, "hyperglycemia", "ileus, epilepsy", "psychotic disorder, diabetes", "", "endocarditis, septicemia, neoplasm", "influenza", "", "chronic alcoholic intoxication, hypoglycemia", "lymphatic diseases, Pneumocystis carinii pneumonia, depressive disorder, suicide attempt", "shortness of breath, headache, pain abdominal"
745, 75, F, Native American or Alaska Native, AB+, "bipolar disorder, gastroenteritis", "pneumothorax", "hepatitis, epilepsy", "dependence", "influenza", "coronary heart disease", "hernia hiatal, myocardial infarction, deglutition disorder, manic disorder, tonic-clonic epilepsy, failure heart", "dependence", "anemia, decubitus ulcer, obesity, benign prostatic hypertrophy, sepsis (invertebrate), coronary heart disease", "apyrexial, palpitation"
746, 25, F, Black or African American, AB-, "malignant neoplasm of lung, hemorrhoids, neuropathy", "pericardial effusion body substance, ileus, insufficiency renal", "bronchitis, personality disorder, embolism pulmonary", "influenza", "", "", "", "", "", "hypokinesia"
747, 83, F, White, O+, "bacteremia, obesity", "sepsis (invertebrate)", "depressive disorder, neutropenia", "failure kidney, dependence, gastritis, pancreatitis, spasm bronchial, carcinoma breast", "hypoglycemia, malignant tumor of colon", "depressive disorder", "confusion, tonic-clonic seizures", "hypercholesterolemia, pneumothorax, gastritis", "tonic-clonic epilepsy", "ascites, cushingoid facies, thicken"
748, 53, M, White, AB+, "hypertension pulmonary", "anemia", "neuropathy, upper respiratory infection, pyelonephritis", "neoplasm metastasis", "fibroid tumor, failure heart, malignant neoplasm of lung, carcinoma prostate", "chronic obstructive airway disease, bipolar disorder, glaucoma", "cellulitis, coronary heart disease, hiv infections, pneumothorax, dementia", "", "", "unresponsiveness, anorexia, angina pectoris"
749, 22, F, White, B-, "hyperglycemia, ketoacidosis diabetic ", "glaucoma", "edema pulmonary, influenza", "carcinoma breast, accident cerebrovascular, failure heart", "", "", "", "", "", "sore to touch, decreased body weight"
750, 4, F, Asian, B+, "", "", "", "", "", "", "", "", "", "neologism, suicidal"
751, 16, F, White, AB+, "", "influenza", "gastroenteritis", "", "", "", "", "", "", "diarrhea"
752, 52, F, Black or African American, A+, "depression mental, melanoma, accident cerebrovascular", "personality disorder", "neuropathy", "bipolar disorder", "bipolar disorder, hyperlipidemia", "carcinoma of lung", "failure heart, influenza, gout", "", "", "verbal auditory hallucinations"
753, 67, F, Some other race, B+, "migraine disorders", "obesity morbid, dependence", "chronic obstructive airway disease, depressive disorder", "spasm bronchial", "insufficiency renal, thrombocytopaenia, arthritis, influenza, osteoporosis, infection", "malignant tumor of colon, hyperglycemia", "tonic-clonic seizures", "parkinson disease, carcinoma of lung, cellulitis, HIV, glaucoma, cirrhosis", "", "swelling"
754, 76, M, White, B+, "septicemia", "diverticulitis", "paroxysmal dyspnea", "dependence", "fibroid tumor, influenza, stenosis aortic valve", "acquired immuno-deficiency syndrome, septicemia", "ketoacidosis diabetic , acquired immuno-deficiency syndrome", "mitral valve insufficiency", "chronic alcoholic intoxication, suicide attempt, paroxysmal dyspnea", "fatigue, ecchymosis"
755, 27, M, White, A+, "", "influenza, hepatitis B", "bacteremia", "personality disorder, myocardial infarction, Pneumocystis carinii pneumonia", "", "", "", "", "", "abscess bacterial, pain"
756, 51, F, Asian, AB-, "spasm bronchial, colitis", "carcinoma prostate, pneumonia aspiration, depression mental", "", "", "candidiasis, encephalopathy", "diverticulitis, benign prostatic hypertrophy, spasm bronchial, coronary heart disease, anxiety state", "thrombus, neoplasm, hepatitis B", "", "", "retropulsion"
757, 32, F, Asian, A+, "", "delusion", "bipolar disorder", "failure heart, obesity", "sepsis (invertebrate), anxiety state", "", "", "", "", "snuffle"
758, 13, F, Asian, B+, "sickle cell anemia", "", "neoplasm, schizophrenia", "", "", "", "", "", "", "hypesthesia, abscess bacterial, scratch marks"
759, 18, M, Native Hawaiians or Other Pacific Islander, A+, "respiratory failure, thrombocytopaenia", "hypertension pulmonary, paranoia", "gastroenteritis, adhesion, dementia", "", "", "", "", "", "", "sweat"
760, 42, M, Two or more races, AB+, "arthritis, gastroesophageal reflux disease", "", "influenza", "influenza", "hypertensive disease, osteomyelitis, schizophrenia, migraine disorders", "tonic-clonic seizures", "", "", "", "pain, headache"
761, 34, F, Black or African American, A-, "dementia", "thrombus, diverticulitis, myocardial infarction", "stenosis aortic valve, carcinoma", "diverticulitis", "bipolar disorder", "", "", "", "", "yellow sputum, rale"
762, 32, F, Black or African American, B+, "hemiparesis", "malignant neoplasm of lung", "gastroesophageal reflux disease", "malignant neoplasm of breast, confusion, lymphoma, migraine disorders, primary malignant neoplasm", "hernia, anxiety state, colitis, transient ischemic attack", "", "", "", "", "labored breathing, angina pectoris"
763, 73, F, Native American or Alaska Native, AB-, "influenza", "malignant neoplasm of prostate, influenza", "hernia hiatal, schizophrenia", "gastritis, sepsis (invertebrate)", "pneumonia aspiration, deep vein thrombosis, neutropenia", "primary malignant neoplasm, kidney failure acute, encephalopathy", "Alzheimer's disease, hernia, hepatitis", "failure heart, aphasia, bacteremia, tricuspid valve insufficiency, systemic infection, depression mental", "affect labile, chronic kidney failure", "distress respiratory"
764, 8, M, Native American or Alaska Native, AB+, "depression mental", "hyperglycemia, candidiasis", "", "", "", "", "", "", "", "asymptomatic, dyspnea"
765, 17, F, White, A-, "cellulitis, respiratory failure", "degenerative polyarthritis, epilepsy, personality disorder", "benign prostatic hypertrophy, infection urinary tract, glaucoma", "", "", "", "", "", "", "pain"
766, 4, F, Two or more races, B+, "adhesion", "", "", "", "", "", "", "", "", "agitation, extrapyramidal sign, hypersomnia, loose associations, feeling hopeless"
767, 81, F, Two or more races, O+, "schizophrenia", "hypothyroidism", "benign prostatic hypertrophy, gastroesophageal reflux disease", "influenza, gastritis", "cirrhosis", "confusion, delirium, chronic kidney failure, gout", "systemic infection, sepsis (invertebrate), influenza", "anemia, hyperglycemia", "chronic obstructive airway disease", "rale, guaiac positive"
768, 19, M, White, O-, "deep vein thrombosis, insufficiency renal, infection", "", "primary carcinoma of the liver cells", "", "", "", "", "", "", "vomiting, pain"
769, 18, M, Native Hawaiians or Other Pacific Islander, AB-, "transient ischemic attack", "endocarditis, hyperglycemia", "embolism pulmonary, diabetes", "", "", "", "", "", "", "swelling"
770, 35, F, White, O+, "epilepsy, affect labile", "influenza", "primary malignant neoplasm, pyelonephritis, osteoporosis", "carcinoma, hepatitis, failure heart, manic disorder, hiv infections", "coronary heart disease", "", "", "", "", "sputum purulent, wheezing, chest tightness"
771, 62, M, Two or more races, AB+, "pancreatitis", "", "thrombus, biliary calculus", "neuropathy, edema pulmonary, cholelithiasis", "influenza, carcinoma of lung", "aphasia, cellulitis", "insufficiency renal, cholelithiasis, hemorrhoids, psychotic disorder", "ulcer peptic", "", "shortness of breath, decreased body weight, large-for-dates fetus"
772, 45, M, Black or African American, A+, "deep vein thrombosis, tachycardia sinus, pneumonia aspiration", "delusion, deep vein thrombosis, dehydration", "embolism pulmonary, ulcer peptic", "chronic kidney failure, sepsis (invertebrate), degenerative polyarthritis", "chronic obstructive airway disease", "malignant neoplasm of prostate, anemia", "", "", "", "splenomegaly, pain abdominal, pruritus"
773, 20, M, White, A+, "influenza", "pancytopenia, depression mental", "thrombocytopaenia", "", "", "", "", "", "", "verbal auditory hallucinations, intoxication, hallucinations auditory"
774, 21, M, Black or African American, A+, "hemorrhoids, adenocarcinoma", "psychotic disorder", "gastritis, hepatitis C", "carcinoma, kidney disease, delusion", "", "", "", "", "", "fall, paraparesis"
775, 67, F, Some other race, AB-, "bipolar disorder, biliary calculus", "infection, hypothyroidism", "infection urinary tract, melanoma", "encephalopathy, anemia, incontinence, gastritis, primary malignant neoplasm, paranoia", "cirrhosis, diverticulosis, stenosis aortic valve, hyperlipidemia, systemic infection, carcinoma breast", "acquired immuno-deficiency syndrome, coronary heart disease", "neoplasm, influenza, epilepsy", "coronary heart disease, hernia, chronic alcoholic intoxication", "", "diarrhea, transaminitis"
776, 35, M, Native American or Alaska Native, AB+, "obesity", "gastritis, migraine disorders", "melanoma, influenza", "carcinoma colon, gastritis, respiratory failure", "delirium, transient ischemic attack, colitis", "", "", "", "", "ecchymosis"
777, 64, F, White, AB+, "carcinoma colon", "influenza, kidney failure acute", "gout, influenza", "hypothyroidism", "failure heart, tonic-clonic seizures, carcinoma", "adenocarcinoma, embolism pulmonary, adhesion", "ketoacidosis diabetic , Alzheimer's disease, obesity morbid", "failure heart congestive, influenza, Alzheimer's disease", "", "decreased body weight, patient non compliance, productive cough, spontaneous rupture of membranes"
778, 70, F, Black or African American, A+, "hyperglycemia, neuropathy, acquired immuno-deficiency syndrome", "Pneumocystis carinii pneumonia, tonic-clonic seizures", "diverticulosis", "encephalopathy, gastritis, pancytopenia, degenerative polyarthritis, malignant neoplasm of breast", "hypercholesterolemia, ketoacidosis diabetic , suicide attempt, exanthema, candidiasis", "hernia hiatal, infection urinary tract", "hypertensive disease, anxiety state", "influenza, accident cerebrovascular", "", "dysuria, urge incontinence, decreased body weight"
779, 67, M, Two or more races, B-, "carcinoma, gout", "deglutition disorder", "encephalopathy, hernia", "encephalopathy, affect labile, malignant neoplasm of lung, gastritis", "failure kidney, endocarditis, aphasia", "arthritis, gastritis, emphysema pulmonary", "colitis", "asthma", "", "spontaneous rupture of membranes, decreased body weight, muscle hypotonia"
780, 20, M, Black or African American, O+, "influenza, adhesion", "hypertensive disease", "effusion pericardial", "", "", "", "", "", "", "aura"
781, 23, F, Two or more races, O-, "sepsis (invertebrate), lymphatic diseases", "depressive disorder, anemia", "neuropathy", "kidney disease, spasm bronchial, sepsis (invertebrate), tonic-clonic seizures", "", "", "", "", "", "vomiting, shooting pain"
782, 37, F, White, B+, "oral candidiasis, infection", "obesity morbid, malignant neoplasms, osteoporosis", "degenerative polyarthritis, adenocarcinoma", "edema pulmonary, affect labile", "neoplasm", "", "", "", "", "urge incontinence, seizure"
783, 34, F, Black or African American, O+, "pericardial effusion body substance", "", "ulcer peptic, depressive disorder, hepatitis B", "respiratory failure, infection urinary tract, malignant tumor of colon, mitral valve insufficiency, hypoglycemia", "chronic alcoholic intoxication, tonic-clonic seizures", "", "", "", "", "charleyhorse, muscle twitch, egophony"
784, 80, F, Native American or Alaska Native, O+, "diverticulitis", "dependence", "melanoma, pericardial effusion body substance, hernia hiatal", "parkinson disease, migraine disorders, gastritis", "delusion", "carcinoma colon, transient ischemic attack, malignant neoplasm of breast, tonic-clonic seizures", "diabetes, acquired immuno-deficiency syndrome", "depressive disorder", "gastritis, colitis", "orthopnea, shortness of breath, pressure chest"
785, 61, F, Some other race, AB+, "anemia, chronic kidney failure", "malignant neoplasm of lung", "", "", "endocarditis, stenosis aortic valve", "parkinson disease", "failure heart", "sepsis (invertebrate), hyperlipidemia, anxiety state, influenza, hyperglycemia", "", "dyspnea on exertion, heavy legs"
786, 11, M, Some other race, O+, "infection, carcinoma colon", "cholelithiasis, influenza, biliary calculus", "colitis, neoplasm", "", "", "", "", "", "", "dyspnea, shortness of breath"
787, 60, M, Native Hawaiians or Other Pacific Islander, O+, "dementia", "tonic-clonic epilepsy, myocardial infarction", "fibroid tumor, gastroenteritis, neuropathy", "carcinoma of lung, myocardial infarction, hernia hiatal, influenza", "influenza, lymphoma", "ischemia, benign prostatic hypertrophy, dependence", "spasm bronchial, hypothyroidism, osteomyelitis", "", "", "asthenia, distended abdomen, shortness of breath"
788, 13, F, Asian, B-, "benign prostatic hypertrophy", "diabetes", "biliary calculus", "", "", "", "", "", "", "hot flush, suicidal, mood depressed"
789, 81, F, White, O+, "neoplasm metastasis, tonic-clonic epilepsy", "malignant tumor of colon, deep vein thrombosis", "migraine disorders, exanthema", "hepatitis C, decubitus ulcer, ileus", "delirium, cardiomyopathy, pancreatitis, coronary arteriosclerosis", "tonic-clonic seizures, bronchitis", "insufficiency renal, tachycardia sinus, thrombus, failure heart congestive, oral candidiasis, personality disorder", "lymphatic diseases, chronic alcoholic intoxication, chronic obstructive airway disease, anxiety state, osteomyelitis, oral candidiasis", "tricuspid valve insufficiency, bacteremia", "shortness of breath, chest discomfort"
790, 73, F, Black or African American, AB+, "cardiomyopathy", "infection, dementia, exanthema", "sickle cell anemia, malignant neoplasm of prostate", "sepsis (invertebrate), overload fluid, hypoglycemia, degenerative polyarthritis", "hepatitis C, degenerative polyarthritis", "deglutition disorder", "psychotic disorder, asthma, deglutition disorder, chronic alcoholic intoxication", "coronary arteriosclerosis, Alzheimer's disease", "endocarditis, hernia", "asthenia"
791, 38, M, Black or African American, B-, "kidney disease, primary carcinoma of the liver cells, pancytopenia", "failure heart congestive", "", "endocarditis", "effusion pericardial, epilepsy", "", "", "", "", "angina pectoris, labored breathing"
792, 50, F, White, B-, "edema pulmonary", "obesity morbid, degenerative polyarthritis", "ulcer peptic, diabetes, pyelonephritis", "cholelithiasis", "sepsis (invertebrate), malignant neoplasm of breast", "ketoacidosis diabetic , bipolar disorder", "", "", "", "haemorrhage, apyrexial"
793, 14, M, White, A-, "carcinoma prostate", "mitral valve insufficiency, deep vein thrombosis, cardiomyopathy", "decubitus ulcer", "", "", "", "", "", "", "room spinning, clumsiness, extrapyramidal sign, vision blurred"
794, 43, F, Black or African American, B+, "hypothyroidism, hepatitis B", "hyperbilirubinemia", "", "obesity morbid, pancytopenia", "paranoia, sickle cell anemia, bipolar disorder", "hyperbilirubinemia", "", "", "", "hoarseness, ascites, cushingoid facies"
795, 84, F, Native American or Alaska Native, AB+, "kidney failure acute, colitis", "ulcer peptic", "incontinence, spasm bronchial", "", "chronic alcoholic intoxication, delusion, ketoacidosis diabetic ", "bipolar disorder, kidney disease, embolism pulmonary", "bipolar disorder", "sickle cell anemia, transient ischemic attack", "emphysema pulmonary, colitis, malignant tumor of colon, tachycardia sinus, coronary heart disease", "phonophobia, hirsutism, drowsiness"
796, 79, M, White, B+, "chronic obstructive airway disease, myocardial infarction, manic disorder", "pneumonia aspiration, oral candidiasis", "neutropenia, kidney disease", "paroxysmal dyspnea, deep vein thrombosis", "myocardial infarction, pneumonia aspiration, influenza", "hiv infections, failure heart", "effusion pericardial, Alzheimer's disease, chronic alcoholic intoxication", "acquired immuno-deficiency syndrome", "hypertensive disease", "t wave inverted, scar tissue, pressure chest"
797, 21, F, White, AB+, "epilepsy, kidney disease, osteomyelitis", "cardiomyopathy", "pneumonia, carcinoma of lung", "anxiety state, emphysema pulmonary", "", "", "", "", "", "rale"
798, 46, M, Black or African American, O+, "incontinence", "hepatitis C", "failure heart congestive, decubitus ulcer, delirium", "gastritis, emphysema pulmonary, tachycardia sinus", "pneumonia, carcinoma colon, stenosis aortic valve", "gastritis, suicide attempt", "", "", "", "fall"
799, 36, F, White, O+, "diabetes", "hypoglycemia", "hypertension pulmonary", "influenza", "malignant neoplasm of breast, suicide attempt", "", "", "", "", "pain neck, lung nodule"
800, 80, F, White, AB-, "depressive disorder, ketoacidosis diabetic ", "delirium, sickle cell anemia, adenocarcinoma", "osteoporosis, pneumothorax, ulcer peptic", "myocardial infarction, hiv infections", "gastroesophageal reflux disease, neoplasm, malignant neoplasm of lung, influenza, hyperbilirubinemia, acquired immuno-deficiency syndrome", "deglutition disorder, aphasia", "Pneumocystis carinii pneumonia, influenza, myocardial infarction, obesity morbid", "hepatitis, osteomyelitis, deep vein thrombosis, affect labile", "hernia hiatal", "shooting pain, lesion, urinary hesitation"
801, 66, F, Black or African American, O+, "neoplasm metastasis, influenza, suicide attempt", "primary malignant neoplasm", "failure heart congestive, hepatitis C, carcinoma colon", "ileus", "delusion, obesity, failure heart congestive, edema pulmonary, diverticulitis", "glaucoma, influenza, chronic obstructive airway disease, tonic-clonic epilepsy", "gastritis, sickle cell anemia, failure heart", "stenosis aortic valve", "", "sweating increased, mental status changes"
