2265, 78, F, White, O+, "tachycardia sinus, malignant neoplasm of prostate", "hernia hiatal, pyelonephritis", "carcinoma", "spasm bronchial, parkinson disease, chronic alcoholic intoxication", "gastritis, chronic alcoholic intoxication, anemia, degenerative polyarthritis", "failure heart, malignant neoplasm of breast", "pancytopenia", "systemic infection, spasm bronchial, septicemia", "adhesion, Alzheimer's disease, hemorrhoids, gastritis, influenza", "bradykinesia, apyrexial"
2266, 43, M, Native Hawaiians or Other Pacific Islander, A+, "hypothyroidism, paroxysmal dyspnea, failure kidney", "fibroid tumor, carcinoma", "tonic-clonic epilepsy, sepsis (invertebrate)", "thrombocytopaenia, delirium, dehydration", "", "accident cerebrovascular, failure kidney, pneumonia aspiration", "", "", "", "phonophobia, headache"
2267, 42, M, White, O-, "septicemia, aphasia", "insufficiency renal, chronic kidney failure", "delirium, pneumonia aspiration", "influenza, lymphatic diseases, confusion, migraine disorders", "benign prostatic hypertrophy, delirium, melanoma", "malignant neoplasms, cellulitis, schizophrenia, failure heart", "", "", "", "worry, has religious belief, blackout"
2268, 37, M, Black or African American, O+, "embolism pulmonary", "", "osteoporosis", "lymphatic diseases, fibroid tumor", "", "", "", "", "", "paresis"
2269, 36, F, White, B+, "carcinoma prostate, anemia", "spasm bronchial, influenza, kidney disease", "melanoma, bacteremia", "failure heart, exanthema", "malignant neoplasms, carcinoma breast, colitis, incontinence", "", "", "", "", "lesion, non-productive cough, egophony"
2270, 66, F, White, A+, "neoplasm, ischemia", "hyperlipidemia", "paroxysmal dyspnea, schizophrenia", "hemorrhoids, hiv infections, gout", "", "manic disorder, gastritis, pancytopenia", "HIV, pneumonia aspiration", "gastritis, malignant tumor of colon, anemia", "", "chest tightness, shortness of breath, non-productive cough"
2271, 24, M, Some other race, O+, "diverticulosis, fibroid tumor, coronary arteriosclerosis", "", "carcinoma, overload fluid", "carcinoma prostate, hyperglycemia", "", "", "", "", "", "headache, lesion"
2272, 53, M, White, A+, "tachycardia sinus", "cirrhosis, malignant neoplasms", "glaucoma, obesity", "influenza", "dependence, hypercholesterolemia, biliary calculus", "anxiety state, failure heart, Alzheimer's disease", "tricuspid valve insufficiency, hepatitis B, diverticulitis", "", "", "fever, pain chest"
2273, 19, F, Some other race, A+, "migraine disorders", "", "suicide attempt", "", "", "", "", "", "", "stiffness, drowsiness, syncope, difficulty"
2274, 62, M, Black or African American, AB+, "migraine disorders, depression mental", "adenocarcinoma, failure kidney", "malignant neoplasm of prostate, hernia hiatal", "upper respiratory infection", "chronic kidney failure, sickle cell anemia, hernia", "failure heart", "coronary heart disease, osteoporosis, overload fluid", "kidney failure acute", "", "rambling speech"
2275, 9, M, White, O+, "cholecystitis, emphysema pulmonary", "hyperbilirubinemia, dementia", "", "", "", "", "", "", "", "rale, tachypnea, fever"
2276, 6, F, Native American or Alaska Native, B-, "influenza, pancytopenia, sepsis (invertebrate)", "endocarditis, emphysema pulmonary, thrombus", "", "", "", "", "", "", "", "blanch, suicidal, difficulty"
2277, 20, F, Black or African American, A+, "infection urinary tract", "fibroid tumor, lymphatic diseases", "osteomyelitis, influenza, hypothyroidism", "", "", "", "", "", "", "stupor, decreased translucency"
2278, 72, M, White, O+, "", "cellulitis, migraine disorders", "", "sepsis (invertebrate), neoplasm metastasis", "bacteremia, paroxysmal dyspnea, pyelonephritis, arthritis, degenerative polyarthritis", "gout, HIV, paranoia, hypoglycemia", "tricuspid valve insufficiency, neoplasm, hemiparesis", "oral candidiasis, delusion, influenza", "hypoglycemia, failure heart, upper respiratory infection", "food intolerance, asthenia"
2279, 56, M, Two or more races, B+, "cholelithiasis, psychotic disorder", "", "delirium, diabetes, gastritis", "hernia, obesity morbid, affect labile", "hypoglycemia, hypercholesterolemia, schizophrenia, chronic obstructive airway disease", "embolism pulmonary, failure heart, Alzheimer's disease, influenza, coronary heart disease", "dementia, chronic alcoholic intoxication", "", "", "distress respiratory, bradycardia, haemorrhage"
2280, 76, M, Black or African American, AB+, "accident cerebrovascular, neoplasm", "hepatitis B, thrombocytopaenia", "cirrhosis", "malignant neoplasms", "cardiomyopathy", "failure kidney", "neoplasm", "degenerative polyarthritis, upper respiratory infection, bacteremia, bipolar disorder, carcinoma prostate, endocarditis", "transient ischemic attack, neutropenia", "pain chest, dyspnea, bradycardia, shortness of breath, sleepy"
2281, 51, F, Some other race, B+, "", "benign prostatic hypertrophy", "thrombocytopaenia, kidney failure acute", "hypercholesterolemia, influenza, hypothyroidism, failure heart", "lymphatic diseases, pneumonia aspiration", "coronary heart disease, hyperglycemia", "peripheral vascular disease, diverticulitis, myocardial infarction, Alzheimer's disease", "", "", "patient non compliance, hypercapnia"
2282, 34, F, Two or more races, O-, "myocardial infarction, carcinoma, primary malignant neoplasm", "influenza", "", "stenosis aortic valve, confusion, osteomyelitis", "hepatitis C, influenza, mitral valve insufficiency, hyperbilirubinemia", "", "", "", "", "large-for-dates fetus, unsteady gait"
2283, 33, M, Black or African American, B+, "malignant neoplasm of prostate, hemiparesis", "", "respiratory failure, manic disorder", "transient ischemic attack, thrombus, pericardial effusion body substance", "respiratory failure", "", "", "", "", "unsteady gait, flatulence, vomiting"
2284, 14, M, Black or African American, A+, "colitis, insufficiency renal, infection urinary tract", "paranoia, degenerative polyarthritis", "systemic infection", "", "", "", "", "", "", "hydropneumothorax, superimposition, nausea and vomiting"
2285, 3, M, White, AB+, "paroxysmal dyspnea, parkinson disease, psychotic disorder", "", "", "", "", "", "", "", "", "fever, pain"
2286, 12, M, White, AB+, "hepatitis B, ulcer peptic, stenosis aortic valve", "hypertensive disease, adhesion", "paroxysmal dyspnea, influenza, obesity morbid", "", "", "", "", "", "", "tumor cell invasion, pain back, asthenia"
2287, 23, F, Black or African American, AB-, "schizophrenia", "hypertensive disease, influenza", "dehydration", "malignant neoplasms", "", "", "", "", "", "chest tightness, night sweat"
2288, 59, F, Asian, AB-, "dementia", "malignant neoplasm of lung, diabetes, tonic-clonic epilepsy", "cardiomyopathy, ketoacidosis diabetic ", "diverticulosis", "pneumonia aspiration, hyperlipidemia", "tonic-clonic seizures", "hyperlipidemia, hyperbilirubinemia, malignant neoplasm of breast", "", "", "pain chest, shortness of breath, syncope"
2289, 43, M, White, B+, "hepatitis B, depressive disorder", "hepatitis B", "myocardial infarction", "epilepsy", "acquired immuno-deficiency syndrome", "acquired immuno-deficiency syndrome, gastritis", "", "", "", "agitation, irritable mood, homelessness"
2290, 58, M, White, AB+, "infection, Pneumocystis carinii pneumonia", "affect labile", "ileus, sepsis (invertebrate)", "upper respiratory infection, thrombus, cardiomyopathy, ulcer peptic, transient ischemic attack", "cellulitis, Pneumocystis carinii pneumonia, neutropenia", "hypothyroidism, hiv infections, neuropathy, deglutition disorder", "cirrhosis, stenosis aortic valve, coronary heart disease", "", "", "sedentary"
2291, 71, M, Native American or Alaska Native, B+, "neuropathy, respiratory failure", "psychotic disorder", "hernia hiatal, spasm bronchial", "obesity morbid, gastritis", "acquired immuno-deficiency syndrome, pericardial effusion body substance", "thrombus", "Alzheimer's disease, deglutition disorder, failure heart, cirrhosis, dementia", "depressive disorder, ulcer peptic, neuropathy, chronic alcoholic intoxication, Alzheimer's disease, cholecystitis", "paranoia", "nightmare, feeling suicidal, suicidal, worry"
2292, 77, F, Two or more races, O-, "hemiparesis", "", "hepatitis C", "personality disorder, carcinoma breast, diverticulitis", "gastritis", "hypercholesterolemia", "coronary heart disease, failure heart, hepatitis", "obesity, cellulitis, paroxysmal dyspnea, malignant neoplasm of breast", "Alzheimer's disease", "lesion, stridor"
2293, 54, F, Black or African American, B-, "sepsis (invertebrate)", "psychotic disorder, transient ischemic attack", "primary malignant neoplasm", "failure heart congestive, tachycardia sinus, neoplasm metastasis", "hiv infections, embolism pulmonary, Alzheimer's disease", "Alzheimer's disease, colitis, hiv infections, carcinoma breast", "arthritis", "", "", "pain chest, pruritus, hyperacusis"
2294, 19, F, Two or more races, O-, "pancreatitis", "gastroenteritis, hyperlipidemia, pancreatitis", "tachycardia sinus", "", "", "", "", "", "", "hemiplegia, fever, extreme exhaustion"
2295, 35, M, Some other race, A+, "hernia", "hepatitis, hernia hiatal", "epilepsy", "mitral valve insufficiency, failure heart congestive, hypertension pulmonary, carcinoma, gastritis", "hypercholesterolemia, neuropathy", "", "", "", "", "pain chest, anosmia"
2296, 28, F, Asian, O+, "hypoglycemia", "", "influenza, manic disorder", "bipolar disorder", "", "", "", "", "", "sleepy, dyspnea, hyperkalemia"
2297, 75, F, White, A-, "", "adhesion", "influenza, bronchitis", "kidney disease, influenza", "glaucoma, influenza", "kidney failure acute, Alzheimer's disease, Pneumocystis carinii pneumonia, influenza", "chronic alcoholic intoxication, transient ischemic attack", "osteoporosis", "cardiomyopathy, schizophrenia, peripheral vascular disease, paranoia, tonic-clonic seizures", "snuffle, chill, cough"
2298, 56, M, White, A+, "hemiparesis, respiratory failure", "hypertensive disease", "deglutition disorder", "primary carcinoma of the liver cells, candidiasis, benign prostatic hypertrophy", "osteoporosis, coronary heart disease, neoplasm metastasis", "suicide attempt", "diabetes, parkinson disease, carcinoma prostate", "", "", "impaired cognition, fever"
2299, 44, M, White, B+, "ischemia, hypertension pulmonary", "kidney disease, depression mental", "influenza", "neoplasm metastasis, osteomyelitis, suicide attempt", "pancytopenia, ulcer peptic", "chronic obstructive airway disease, hypertensive disease", "", "", "", "presence of q wave, dizziness"
2300, 70, M, Some other race, B+, "arthritis, fibroid tumor", "upper respiratory infection", "personality disorder", "hepatitis B, influenza, coronary heart disease", "tricuspid valve insufficiency", "", "failure heart", "chronic alcoholic intoxication, affect labile, kidney disease", "", "mass in breast, fever"
2301, 4, F, Black or African American, A+, "bipolar disorder, pericardial effusion body substance", "", "", "", "", "", "", "", "", "decreased body weight, headache"
2302, 82, F, White, A-, "cirrhosis, effusion pericardial, psychotic disorder", "failure heart congestive, influenza", "hemiparesis, sickle cell anemia", "paroxysmal dyspnea", "anxiety state", "acquired immuno-deficiency syndrome", "influenza", "sickle cell anemia", "tonic-clonic epilepsy, neoplasm metastasis", "lesion"
2303, 53, F, Black or African American, A-, "", "pancreatitis, mitral valve insufficiency", "ischemia", "stenosis aortic valve, obesity", "carcinoma breast, hiv infections", "manic disorder, upper respiratory infection, parkinson disease", "carcinoma prostate, decubitus ulcer, degenerative polyarthritis", "", "", "weight gain, drowsiness, jugular venous distention"
2304, 53, F, White, A+, "migraine disorders, kidney disease", "emphysema pulmonary, gastritis", "obesity, depression mental", "cholelithiasis, hyperbilirubinemia", "cardiomyopathy", "influenza, diabetes", "stenosis aortic valve", "", "", "jugular venous distention, oliguria, catatonia, hyperkalemia"
2305, 12, F, Asian, B+, "respiratory failure", "kidney disease, diverticulosis", "lymphoma", "", "", "", "", "", "", "haemorrhage, dizziness"
2306, 24, F, White, AB+, "dependence, malignant tumor of colon, tonic-clonic seizures", "kidney disease, influenza, neutropenia", "neoplasm, acquired immuno-deficiency syndrome", "carcinoma prostate, neuropathy, gastritis, failure heart congestive, spasm bronchial, dependence", "", "", "", "", "", "gravida 0, hyperkalemia, shortness of breath"
2307, 55, M, Black or African American, AB-, "arthritis, failure kidney, degenerative polyarthritis", "", "tachycardia sinus", "kidney disease, coronary heart disease", "", "aphasia, stenosis aortic valve, obesity morbid", "hypertensive disease", "", "", "ataxia, dysuria"
2308, 29, F, Some other race, AB+, "bacteremia", "delirium, depressive disorder", "hepatitis", "gastroenteritis, influenza, coronary heart disease", "", "", "", "", "", "lethargy, headache, unresponsiveness, asterixis"
2309, 44, M, White, A+, "tricuspid valve insufficiency, thrombocytopaenia", "osteomyelitis, transient ischemic attack", "hemiparesis", "septicemia, gastritis", "gastroesophageal reflux disease", "coronary heart disease", "", "", "", "consciousness clear"
2310, 69, F, Asian, A+, "stenosis aortic valve, hyperbilirubinemia", "chronic obstructive airway disease, lymphatic diseases, aphasia", "failure heart congestive, hypothyroidism", "pericardial effusion body substance, anemia", "HIV, failure kidney, malignant neoplasm of breast", "", "hypothyroidism, gastritis, carcinoma breast", "failure heart, pneumonia, insufficiency renal", "", "pain, pain abdominal, metastatic lesion"
2311, 61, M, Two or more races, B+, "failure kidney, biliary calculus, pancreatitis", "", "carcinoma prostate, paroxysmal dyspnea", "paranoia", "primary malignant neoplasm, gastroenteritis", "chronic alcoholic intoxication", "endocarditis, benign prostatic hypertrophy", "cardiomyopathy, paranoia", "", "apyrexial, hypotension"
2312, 80, F, White, B+, "diverticulitis, paranoia, carcinoma colon", "malignant neoplasm of lung, tachycardia sinus", "", "thrombus, aphasia, deglutition disorder", "lymphoma, gastritis, depression mental", "gout", "asthma, primary carcinoma of the liver cells, cholelithiasis, gastroesophageal reflux disease", "degenerative polyarthritis, candidiasis", "oral candidiasis, failure heart congestive", "hallucinations visual, underweight, hypersomnolence"
2313, 28, F, Native American or Alaska Native, A+, "primary malignant neoplasm, anemia, melanoma", "", "hepatitis, manic disorder, pyelonephritis", "paroxysmal dyspnea", "", "", "", "", "", "hypotension, claudication"
2314, 47, M, Black or African American, B+, "carcinoma prostate, hyperglycemia", "influenza, tonic-clonic seizures, hypertension pulmonary", "anemia", "stenosis aortic valve", "diverticulosis, parkinson disease, chronic alcoholic intoxication, chronic kidney failure", "gastritis, embolism pulmonary, epilepsy", "", "", "", "nausea, abdominal tenderness, catching breath"
2315, 26, M, White, O+, "encephalopathy, gastroenteritis", "transient ischemic attack", "malignant neoplasm of lung", "dependence, hypertensive disease", "", "", "", "", "", "ache, heavy feeling, distended abdomen, cough"
2316, 41, M, White, O+, "depressive disorder", "", "infection", "chronic alcoholic intoxication, pneumothorax", "asthma", "hemorrhoids, hernia, HIV, schizophrenia", "", "", "", "mood depressed, snore, fatigue"
2317, 5, F, Native Hawaiians or Other Pacific Islander, A+, "influenza", "", "", "", "", "", "", "", "", "hyperkalemia, shortness of breath"
2318, 32, M, Native American or Alaska Native, B-, "neoplasm, hepatitis B, cholecystitis", "benign prostatic hypertrophy", "thrombocytopaenia, tachycardia sinus, schizophrenia", "neoplasm metastasis, migraine disorders, tachycardia sinus", "hypertensive disease, chronic alcoholic intoxication", "", "", "", "", "agitation, haemoptysis, ache"
2319, 32, M, White, A+, "effusion pericardial", "osteoporosis", "gastroenteritis, infection, suicide attempt", "psychotic disorder, pyelonephritis, carcinoma prostate", "hypertension pulmonary", "", "", "", "", "rale, syncope"
2320, 68, M, Black or African American, O+, "dependence", "diverticulosis", "hernia, gastritis, parkinson disease", "ileus, primary carcinoma of the liver cells, asthma, exanthema, deep vein thrombosis, pericardial effusion body substance", "schizophrenia, deep vein thrombosis, stenosis aortic valve", "cardiomyopathy, hepatitis, hypercholesterolemia", "spasm bronchial, edema pulmonary, thrombocytopaenia, osteomyelitis", "thrombocytopaenia, neuropathy, psychotic disorder, arthritis, insufficiency renal", "", "polydypsia, tinnitus"
2321, 39, F, Two or more races, B+, "Pneumocystis carinii pneumonia", "", "neutropenia, mitral valve insufficiency, accident cerebrovascular", "chronic kidney failure", "primary malignant neoplasm, neuropathy, hyperlipidemia, oral candidiasis", "", "", "", "", "anorexia"
2322, 20, M, Black or African American, AB+, "osteomyelitis, sepsis (invertebrate), fibroid tumor", "effusion pericardial, colitis", "pneumothorax, transient ischemic attack", "", "", "", "", "", "", "shortness of breath, nausea"
2323, 8, M, Native Hawaiians or Other Pacific Islander, AB+, "", "melanoma", "", "", "", "", "", "", "", "green sputum, tenesmus"
2324, 42, M, Black or African American, B-, "pericardial effusion body substance, upper respiratory infection", "", "deglutition disorder, psychotic disorder", "failure heart congestive, embolism pulmonary", "gastritis, tonic-clonic seizures, pneumonia", "asthma, candidiasis", "", "", "", "asthenia, hyponatremia"
2325, 27, F, Black or African American, B+, "ischemia, cirrhosis, malignant neoplasm of lung", "systemic infection, sepsis (invertebrate)", "gout, kidney failure acute, cholecystitis", "exanthema, ileus, carcinoma prostate, pneumonia aspiration, kidney failure acute, delusion", "", "", "", "", "", "mass of body structure, lesion, dullness"
2326, 44, M, Asian, AB+, "effusion pericardial", "gastritis, cellulitis", "", "endocarditis, carcinoma prostate", "osteomyelitis, diverticulitis, manic disorder, thrombocytopaenia, exanthema", "epilepsy", "", "", "", "hypokinesia, apyrexial, shortness of breath, hypotension, breath sounds decreased"
2327, 16, M, Native Hawaiians or Other Pacific Islander, AB+, "gastroenteritis, affect labile", "sepsis (invertebrate)", "obesity, primary carcinoma of the liver cells, paranoia", "", "", "", "", "", "", "headache"
2328, 38, M, White, AB-, "cirrhosis", "cellulitis", "tonic-clonic seizures, lymphatic diseases", "influenza", "neoplasm metastasis, cirrhosis", "", "", "", "", "cushingoid habitus, decreased body weight, ascites"
2329, 7, F, Black or African American, A-, "deep vein thrombosis", "hepatitis B, tricuspid valve insufficiency", "", "", "", "", "", "", "", "polydypsia, vomiting, constipation"
2330, 24, M, Black or African American, AB+, "", "tricuspid valve insufficiency, neutropenia, edema pulmonary", "pyelonephritis, emphysema pulmonary, primary malignant neoplasm", "gout, myocardial infarction", "", "", "", "", "", "orthopnea, mental status changes"
2331, 5, F, White, O-, "asthma", "", "", "", "", "", "", "", "", "cushingoid facies"
2332, 76, F, White, A-, "cellulitis", "hemiparesis, hiv infections", "sepsis (invertebrate)", "osteomyelitis, hemorrhoids, deep vein thrombosis", "gastritis, sickle cell anemia", "acquired immuno-deficiency syndrome, septicemia, bipolar disorder", "carcinoma colon, infection urinary tract", "Alzheimer's disease, failure heart", "ulcer peptic, thrombocytopaenia", "swelling, redness, abscess bacterial"
2333, 1, M, White, AB+, "pneumonia aspiration", "", "", "", "", "", "", "", "", "pain, facial paresis, pericardial friction rub"
2334, 69, M, White, O+, "adenocarcinoma", "infection, mitral valve insufficiency, adenocarcinoma", "thrombocytopaenia, chronic obstructive airway disease", "", "", "acquired immuno-deficiency syndrome, influenza, anxiety state", "psychotic disorder", "degenerative polyarthritis, anxiety state", "", "shortness of breath, rale"
2335, 44, M, Black or African American, B-, "aphasia, hiv infections, accident cerebrovascular", "obesity, tonic-clonic epilepsy", "hypoglycemia, hernia hiatal", "exanthema, cholecystitis, ischemia", "influenza, decubitus ulcer, malignant tumor of colon", "tonic-clonic epilepsy, deep vein thrombosis, infection urinary tract, transient ischemic attack, hiv infections, anxiety state", "", "", "", "mass of body structure, scleral icterus"
2336, 52, F, Asian, A+, "", "sepsis (invertebrate), gastroenteritis", "migraine disorders", "ileus", "diabetes", "glaucoma", "chronic alcoholic intoxication, thrombus", "", "", "redness"
2337, 33, F, Asian, O+, "infection urinary tract, cardiomyopathy", "delusion", "influenza, dehydration", "malignant neoplasms", "dementia, coronary heart disease, hypertension pulmonary", "", "", "", "", "wheezing, symptom aggravating factors"
2338, 66, F, Black or African American, A+, "", "biliary calculus", "neoplasm metastasis, failure kidney", "bronchitis, Pneumocystis carinii pneumonia, malignant neoplasms", "kidney failure acute, cellulitis, adenocarcinoma, bipolar disorder, hypercholesterolemia", "decubitus ulcer, coronary heart disease", "pneumonia, dementia, chronic kidney failure", "malignant tumor of colon, hemorrhoids", "", "shortness of breath, pressure chest"
2339, 55, F, Asian, A+, "hyperbilirubinemia", "exanthema, malignant neoplasms", "encephalopathy, fibroid tumor", "", "neuropathy, influenza", "coronary heart disease, chronic obstructive airway disease", "acquired immuno-deficiency syndrome, hepatitis, gastritis", "", "", "dysdiadochokinesia, side pain, achalasia"
2340, 6, M, White, AB+, "", "", "", "", "", "", "", "", "", "polymyalgia, passed stones, tumor cell invasion"
2341, 47, F, White, B+, "embolism pulmonary, diabetes", "glaucoma, acquired immuno-deficiency syndrome", "colitis, neutropenia", "adhesion", "bronchitis, diverticulosis, emphysema pulmonary, HIV", "", "", "", "", "oliguria, hypothermia, natural"
2342, 26, F, Black or African American, A+, "upper respiratory infection, hepatitis C, confusion", "diverticulitis", "ileus, Pneumocystis carinii pneumonia, arthritis", "infection, ileus, malignant neoplasm of breast, malignant neoplasm of prostate", "", "", "", "", "", "groggy, pain abdominal"
2343, 41, M, Two or more races, O+, "", "influenza, fibroid tumor", "personality disorder", "", "tachycardia sinus", "adhesion, overload fluid, affect labile, kidney disease", "", "", "", "unresponsiveness, oliguria"
2344, 15, F, Asian, AB-, "tonic-clonic seizures, hemiparesis", "lymphatic diseases", "fibroid tumor", "", "", "", "", "", "", "egophony, facial paresis"
2345, 4, M, White, A+, "", "", "", "", "", "", "", "", "", "patient non compliance, decreased body weight, adverse effect"
2346, 64, F, Some other race, B+, "influenza, gastroenteritis", "", "cirrhosis, systemic infection", "influenza, carcinoma of lung, epilepsy, melanoma, pneumothorax", "cholelithiasis", "coronary heart disease, ischemia, cardiomyopathy, coronary arteriosclerosis, failure heart", "anxiety state", "pyelonephritis", "", "tachypnea, diarrhea"
2347, 55, M, Asian, B-, "gastroenteritis", "", "degenerative polyarthritis, bacteremia, depression mental", "parkinson disease, tonic-clonic seizures, peripheral vascular disease", "", "", "carcinoma, oral candidiasis", "", "", "pain"
2348, 63, F, Some other race, A-, "primary malignant neoplasm, delusion", "hernia, failure heart congestive", "neuropathy", "aphasia, pneumonia, hernia hiatal, hernia, malignant neoplasm of prostate", "hyperbilirubinemia, diverticulitis", "schizophrenia, effusion pericardial, tonic-clonic seizures", "edema pulmonary", "sepsis (invertebrate), pancreatitis", "", "bleeding of vagina, fever"
2349, 58, F, Native American or Alaska Native, B+, "myocardial infarction", "psychotic disorder, neuropathy, overload fluid", "thrombocytopaenia, lymphoma", "hernia, hypoglycemia", "kidney disease", "tonic-clonic seizures, diabetes, gastroenteritis", "respiratory failure, chronic obstructive airway disease, gastroesophageal reflux disease, edema pulmonary, accident cerebrovascular, hernia hiatal", "", "", "guaiac positive, fever"
2350, 1, F, Some other race, B+, "colitis, sepsis (invertebrate), biliary calculus", "", "", "", "", "", "", "", "", "dysarthria"
2351, 75, F, Black or African American, AB+, "degenerative polyarthritis, effusion pericardial", "hypertension pulmonary", "neoplasm, infection", "effusion pericardial, bronchitis, hyperglycemia", "pancytopenia, cholecystitis", "osteoporosis, ischemia", "pneumothorax, anxiety state, cirrhosis", "oral candidiasis, paranoia", "gout, failure heart", "myalgia"
2352, 40, M, White, B+, "suicide attempt", "anemia, epilepsy", "benign prostatic hypertrophy, carcinoma, endocarditis", "carcinoma prostate, influenza", "tonic-clonic epilepsy, influenza, spasm bronchial, paroxysmal dyspnea", "", "", "", "", "hypokinesia, shortness of breath"
2353, 14, F, White, O-, "", "", "exanthema, pneumonia aspiration, influenza", "", "", "", "", "", "", "r wave feature, ecchymosis"
2354, 16, M, White, AB+, "", "lymphatic diseases, delusion, septicemia", "pneumonia aspiration, hypertension pulmonary", "", "", "", "", "", "", "hematuria, vertigo"
2355, 73, M, Asian, O+, "gastritis", "glaucoma", "malignant neoplasm of lung, hiv infections", "degenerative polyarthritis, paranoia", "pericardial effusion body substance", "primary carcinoma of the liver cells, Alzheimer's disease, lymphoma", "malignant neoplasm of lung, hyperbilirubinemia", "effusion pericardial", "chronic kidney failure, transient ischemic attack", "pain, cough, diarrhea"
