ID,Age,Gender,Race,Blood Group,Disease Group A (0-5),Disease Group B (6-10),Disease Group C (11-20),Disease Group D (21-30),Disease Group E (31-40),Disease Group F (41-50),Disease Group G (51-60),Disease Group H (61-70),Disease Group I (70+),Current Symptoms
0, 38, M, Asian, B-, "", "malignant neoplasm of prostate", "depressive disorder, candidiasis", "cardiomyopathy, chronic alcoholic intoxication, parkinson disease, tachycardia sinus", "asthma, influenza, diabetes", "", "", "", "", "chest discomfort"
1, 73, M, White, AB+, "bipolar disorder", "emphysema pulmonary, hypertensive disease", "sickle cell anemia", "pneumonia, ileus", "adenocarcinoma, affect labile", "ischemia, influenza", "HIV, benign prostatic hypertrophy", "parkinson disease", "personality disorder", "hypercapnia, sputum purulent"
2, 64, M, Asian, AB-, "decubitus ulcer, gastroesophageal reflux disease", "gastritis", "influenza", "suicide attempt, lymphatic diseases, bipolar disorder", "malignant neoplasm of prostate, influenza, chronic alcoholic intoxication, tachycardia sinus", "cholelithiasis, emphysema pulmonary, cirrhosis", "", "chronic alcoholic intoxication, hyperglycemia", "", "constipation, groggy, abnormally hard consistency"
3, 59, F, White, B+, "malignant tumor of colon, transient ischemic attack, carcinoma colon", "gastritis, accident cerebrovascular", "aphasia, dependence, neoplasm metastasis", "carcinoma breast, adenocarcinoma, psychotic disorder, insufficiency renal", "epilepsy", "gastritis", "carcinoma colon, diabetes, gastritis", "", "", "abscess bacterial"
4, 41, M, Black or African American, A-, "cholelithiasis", "obesity, kidney disease, arthritis", "hypothyroidism", "adenocarcinoma", "chronic kidney failure, malignant neoplasms, osteoporosis, pyelonephritis", "neuropathy, influenza", "", "", "", "unconscious state, distended abdomen"
5, 36, M, White, B-, "diabetes", "", "gastritis, malignant tumor of colon, carcinoma colon", "hernia", "epilepsy, schizophrenia", "", "", "", "", "hallucinations auditory, transsexual"
6, 55, F, Black or African American, B-, "thrombus, adenocarcinoma", "parkinson disease", "thrombocytopaenia, exanthema", "chronic kidney failure, pericardial effusion body substance, cholelithiasis", "endocarditis, ketoacidosis diabetic , lymphatic diseases, bipolar disorder, neoplasm, hypercholesterolemia", "bipolar disorder", "pancreatitis", "", "", "hemianopsia homonymous, dysuria, dysesthesia"
7, 70, M, Black or African American, AB+, "chronic kidney failure, benign prostatic hypertrophy", "delusion", "pericardial effusion body substance", "cholelithiasis, hypercholesterolemia", "bacteremia, diabetes", "hepatitis C, accident cerebrovascular, influenza", "thrombocytopaenia, pericardial effusion body substance, delusion, hepatitis", "chronic alcoholic intoxication, coronary heart disease, pyelonephritis, pneumonia, spasm bronchial", "", "giddy mood, hemiplegia"
8, 16, F, White, O+, "suicide attempt, cirrhosis, tachycardia sinus", "lymphatic diseases, infection urinary tract, sickle cell anemia", "adenocarcinoma", "", "", "", "", "", "", "seizure, hemiplegia"
9, 2, F, Two or more races, AB+, "deep vein thrombosis", "", "", "", "", "", "", "", "", "mental status changes, lethargy, difficulty passing urine"
10, 16, F, Black or African American, O+, "pericardial effusion body substance", "affect labile", "paranoia", "", "", "", "", "", "", "suicidal, energy increased, feeling suicidal"
11, 28, F, Black or African American, O+, "deglutition disorder", "influenza, spasm bronchial", "schizophrenia, thrombus", "hypertensive disease, obesity morbid, pericardial effusion body substance", "", "", "", "", "", "bleeding of vagina, hyperkalemia, shortness of breath"
12, 33, M, White, O+, "", "", "influenza", "kidney disease", "paranoia, hypercholesterolemia", "", "", "", "", "numbness"
13, 48, F, White, A+, "pancreatitis, suicide attempt", "adhesion, candidiasis, malignant neoplasm of lung", "overload fluid", "influenza", "influenza, upper respiratory infection, transient ischemic attack, acquired immuno-deficiency syndrome, chronic obstructive airway disease", "primary carcinoma of the liver cells, failure heart congestive", "", "", "", "colic abdominal"
14, 48, F, Some other race, B+, "depressive disorder", "", "influenza", "pancreatitis", "diabetes", "spasm bronchial, gastritis, deep vein thrombosis, emphysema pulmonary", "", "", "", "extreme exhaustion"
15, 33, F, Black or African American, O+, "degenerative polyarthritis", "hypothyroidism, upper respiratory infection", "infection urinary tract, gastroesophageal reflux disease, dependence", "influenza", "embolism pulmonary", "", "", "", "", "patient non compliance, motor retardation, worry, terrify"
16, 41, M, White, B+, "spasm bronchial, aphasia", "decubitus ulcer", "pneumothorax, affect labile, gastroesophageal reflux disease", "hypercholesterolemia, Pneumocystis carinii pneumonia", "dependence", "migraine disorders, hypertension pulmonary", "", "", "", "tachypnea, myalgia"
17, 17, M, Black or African American, O+, "carcinoma, benign prostatic hypertrophy", "exanthema, kidney failure acute, ischemia", "bacteremia, acquired immuno-deficiency syndrome", "", "", "", "", "", "", "blackout"
18, 8, M, White, AB+, "hernia, anemia", "candidiasis, hypothyroidism", "", "", "", "", "", "", "", "guaiac positive"
19, 31, M, White, B-, "bronchitis, pneumothorax", "influenza", "gastritis", "glaucoma, malignant tumor of colon, encephalopathy, personality disorder, dehydration, deglutition disorder", "", "", "", "", "", "pain in lower limb, ecchymosis"
20, 34, F, Two or more races, O-, "influenza, sickle cell anemia, embolism pulmonary", "adhesion, incontinence", "osteomyelitis, gastritis, decubitus ulcer", "encephalopathy, gastroenteritis, Alzheimer's disease", "exanthema", "", "", "", "", "chill, swelling, erythema"
21, 22, F, Black or African American, AB-, "accident cerebrovascular, hepatitis", "diverticulitis, bipolar disorder", "suicide attempt, cholecystitis", "diabetes", "", "", "", "", "", "dizziness, fever, numbness, splenomegaly"
22, 63, F, Native Hawaiians or Other Pacific Islander, O-, "edema pulmonary", "cholecystitis, endocarditis", "cholelithiasis", "migraine disorders, ulcer peptic, diverticulosis", "chronic alcoholic intoxication", "obesity, chronic alcoholic intoxication, tonic-clonic seizures", "neutropenia", "osteomyelitis, diabetes, influenza, parkinson disease, malignant tumor of colon, hyperglycemia", "", "mass of body structure"
23, 51, M, Black or African American, AB+, "lymphoma, epilepsy", "encephalopathy", "deep vein thrombosis", "overload fluid, peripheral vascular disease", "insufficiency renal, depressive disorder", "influenza, hiv infections", "acquired immuno-deficiency syndrome, diverticulosis, dehydration, influenza, respiratory failure, bipolar disorder", "", "", "suicidal, hallucinations visual, has religious belief"
24, 71, M, Asian, A+, "fibroid tumor", "chronic kidney failure", "septicemia, delusion", "", "carcinoma colon, HIV, candidiasis, tonic-clonic seizures, pancytopenia, gout", "lymphatic diseases, anemia, overload fluid, coronary heart disease, hepatitis, Pneumocystis carinii pneumonia", "mitral valve insufficiency, diverticulosis, malignant neoplasm of lung", "parkinson disease, asthma, aphasia", "benign prostatic hypertrophy, schizophrenia, gastritis", "nausea, thicken"
25, 28, F, Two or more races, AB-, "pneumonia aspiration, influenza, bacteremia", "coronary arteriosclerosis, influenza", "chronic obstructive airway disease, systemic infection", "delusion, hypertension pulmonary", "", "", "", "", "", "decreased body weight"
26, 39, M, Some other race, B+, "", "encephalopathy, acquired immuno-deficiency syndrome", "paroxysmal dyspnea, parkinson disease", "upper respiratory infection", "peripheral vascular disease, schizophrenia", "", "", "", "", "flare, hypotension, apyrexial"
27, 35, F, Black or African American, AB+, "", "myocardial infarction, ulcer peptic", "sickle cell anemia, thrombus", "overload fluid, effusion pericardial, stenosis aortic valve", "psychotic disorder, influenza", "", "", "", "", "chest discomfort, left atrial hypertrophy, syncope, hypokinesia"
28, 1, F, White, B+, "gastroesophageal reflux disease", "", "", "", "", "", "", "", "", "worry, patient non compliance"
29, 37, F, Two or more races, B+, "", "malignant tumor of colon, stenosis aortic valve", "", "acquired immuno-deficiency syndrome, infection urinary tract, hypertension pulmonary, mitral valve insufficiency, carcinoma of lung", "embolism pulmonary, edema pulmonary, thrombocytopaenia", "", "", "", "", "stuffy nose, intoxication, prostatism"
30, 21, M, Black or African American, O+, "influenza, benign prostatic hypertrophy", "carcinoma prostate, obesity morbid", "", "failure heart, systemic infection, hyperbilirubinemia", "", "", "", "", "", "chill, tachypnea, haemorrhage"
31, 45, M, White, O-, "fibroid tumor, influenza", "hepatitis, hemiparesis", "primary carcinoma of the liver cells", "malignant neoplasm of prostate, bacteremia, paranoia", "ileus, psychotic disorder, ischemia", "hyperglycemia, failure heart, influenza", "", "", "", "sinus rhythm, sore to touch"
32, 44, M, Asian, A-, "upper respiratory infection, influenza", "endocarditis", "carcinoma prostate, spasm bronchial", "gastritis", "glaucoma", "cholelithiasis, obesity morbid, emphysema pulmonary", "", "", "", "hyperkalemia"
33, 41, M, Two or more races, AB-, "", "psychotic disorder", "influenza", "incontinence, hyperbilirubinemia", "acquired immuno-deficiency syndrome, pneumonia aspiration", "infection urinary tract, chronic alcoholic intoxication, cholecystitis", "", "", "", "asthenia, speech slurred"
34, 71, M, Black or African American, B+, "dehydration, accident cerebrovascular", "infection, neoplasm", "neuropathy, gastritis", "schizophrenia", "", "mitral valve insufficiency, dehydration", "hernia hiatal, gastritis", "decubitus ulcer, influenza", "thrombocytopaenia, sepsis (invertebrate), gastroesophageal reflux disease, gastritis", "swelling"
35, 18, M, Black or African American, B+, "hypertensive disease", "emphysema pulmonary, chronic kidney failure", "tachycardia sinus, myocardial infarction", "", "", "", "", "", "", "sleeplessness"
36, 22, M, Black or African American, B-, "gastritis, aphasia", "tonic-clonic seizures", "influenza, depressive disorder", "depressive disorder, failure kidney, transient ischemic attack", "", "", "", "", "", "urge incontinence, asthenia, pleuritic pain"
37, 42, F, Black or African American, AB+, "transient ischemic attack, gastritis, influenza", "spasm bronchial", "gastroenteritis, hypertension pulmonary, delusion", "epilepsy, cirrhosis, carcinoma", "affect labile", "septicemia", "", "", "", "diarrhea"
38, 7, F, Black or African American, A+, "ketoacidosis diabetic , osteomyelitis", "depressive disorder, lymphatic diseases", "", "", "", "", "", "", "", "seizure, suicidal, intoxication"
39, 53, F, White, A+, "transient ischemic attack", "pneumothorax, upper respiratory infection, tonic-clonic epilepsy", "gastritis, affect labile", "bacteremia", "lymphatic diseases, coronary heart disease", "chronic kidney failure, ulcer peptic", "diabetes, psychotic disorder, gastritis, neoplasm", "", "", "indifferent mood, wheezing, non-productive cough"
40, 38, M, Black or African American, A-, "influenza", "depressive disorder, encephalopathy", "hepatitis C, epilepsy, influenza", "hiv infections, cellulitis", "", "", "", "", "", "productive cough, apyrexial, pleuritic pain"
41, 2, M, Native American or Alaska Native, B+, "primary carcinoma of the liver cells, paroxysmal dyspnea, spasm bronchial", "", "", "", "", "", "", "", "", "hunger"
42, 26, M, Black or African American, AB-, "hepatitis C, hyperglycemia", "tonic-clonic epilepsy", "gastritis, migraine disorders", "carcinoma colon, cholelithiasis, stenosis aortic valve, coronary arteriosclerosis", "", "", "", "", "", "nausea, scleral icterus"
43, 33, M, White, O+, "peripheral vascular disease, dementia", "obesity", "anemia, neoplasm, mitral valve insufficiency", "hypothyroidism, overload fluid, cholecystitis, gastritis", "decubitus ulcer, edema pulmonary, depression mental", "", "", "", "", "shortness of breath, dyspnea, orthopnea"
44, 49, M, Black or African American, O+, "systemic infection, deglutition disorder, accident cerebrovascular", "adhesion, tachycardia sinus, osteomyelitis", "neutropenia, primary carcinoma of the liver cells, respiratory failure", "tonic-clonic epilepsy", "ulcer peptic, sepsis (invertebrate), cholecystitis, carcinoma of lung", "upper respiratory infection, gastritis", "", "", "", "spasm, asthenia"
45, 79, F, White, B+, "edema pulmonary, schizophrenia", "paroxysmal dyspnea", "psychotic disorder, peripheral vascular disease, adhesion", "gastroenteritis", "sepsis (invertebrate), depressive disorder", "cirrhosis, epilepsy, paroxysmal dyspnea", "chronic alcoholic intoxication, carcinoma prostate, incontinence", "gastritis", "coronary heart disease, asthma", "groggy"
46, 41, M, Two or more races, O+, "influenza, hypothyroidism", "fibroid tumor, failure kidney", "carcinoma prostate, decubitus ulcer, bronchitis", "pneumothorax, cirrhosis", "incontinence, gastroenteritis, decubitus ulcer, hemiparesis", "mitral valve insufficiency, exanthema, anxiety state", "", "", "", "shortness of breath, haemoptysis, rale"
47, 26, M, Black or African American, B-, "diverticulitis, cholelithiasis", "glaucoma, oral candidiasis", "hyperbilirubinemia, accident cerebrovascular, hyperlipidemia", "cirrhosis, gout, lymphatic diseases, malignant neoplasm of prostate", "", "", "", "", "", "night sweat"
48, 22, M, Native Hawaiians or Other Pacific Islander, A+, "glaucoma", "stenosis aortic valve", "carcinoma prostate, systemic infection, cardiomyopathy", "sepsis (invertebrate)", "", "", "", "", "", "pericardial friction rub, blackout"
49, 47, M, Asian, A+, "epilepsy", "thrombus, gastroenteritis", "epilepsy, tonic-clonic seizures", "carcinoma of lung, hiv infections", "cholecystitis, pancytopenia", "failure kidney", "", "", "", "orthopnea, jugular venous distention, asthenia"
50, 8, F, Two or more races, A-, "degenerative polyarthritis", "cirrhosis, hernia hiatal, bipolar disorder", "", "", "", "", "", "", "", "enuresis, haemorrhage"
51, 11, F, White, AB-, "influenza, carcinoma prostate", "incontinence, hypothyroidism", "benign prostatic hypertrophy, sepsis (invertebrate), hernia", "", "", "", "", "", "", "verbally abusive behavior, hypersomnia, energy increased"
52, 73, F, Black or African American, AB+, "adhesion, chronic obstructive airway disease", "gastritis, hyperlipidemia", "neoplasm metastasis, kidney disease", "pyelonephritis", "failure heart, hyperlipidemia", "", "respiratory failure, hyperlipidemia, thrombocytopaenia", "pyelonephritis", "carcinoma colon, deglutition disorder, emphysema pulmonary, lymphoma, anxiety state", "orthopnea"
53, 42, F, Asian, O+, "neoplasm, candidiasis, accident cerebrovascular", "kidney failure acute", "bacteremia, transient ischemic attack", "epilepsy, influenza", "depressive disorder, hepatitis C, chronic alcoholic intoxication", "chronic alcoholic intoxication, malignant neoplasm of breast", "", "", "", "prostatism"
54, 83, F, White, O-, "psychotic disorder, carcinoma", "affect labile", "decubitus ulcer", "melanoma, insufficiency renal, cirrhosis, fibroid tumor, bipolar disorder, hypercholesterolemia", "diabetes, influenza, dependence, pneumothorax", "endocarditis, chronic alcoholic intoxication", "pancytopenia, epilepsy, upper respiratory infection, emphysema pulmonary, neoplasm metastasis", "carcinoma, adhesion", "insufficiency renal, influenza, kidney failure acute", "cough, productive cough, non-productive cough"
55, 63, F, Black or African American, A+, "infection urinary tract, paroxysmal dyspnea", "melanoma, accident cerebrovascular", "decubitus ulcer", "affect labile, gastroenteritis", "obesity morbid, bipolar disorder", "edema pulmonary, encephalopathy, chronic kidney failure, manic disorder, pancreatitis, deglutition disorder", "coronary heart disease, gastritis", "chronic alcoholic intoxication, malignant neoplasm of prostate, cirrhosis, diabetes", "", "cough"
56, 80, M, Native Hawaiians or Other Pacific Islander, A+, "effusion pericardial, confusion", "asthma, infection urinary tract", "hernia, depression mental", "osteomyelitis, affect labile, chronic kidney failure, pyelonephritis, accident cerebrovascular, asthma", "myocardial infarction, neoplasm metastasis, hypertensive disease, hypothyroidism", "coronary heart disease, hypercholesterolemia", "pancytopenia, hypertension pulmonary, pyelonephritis, gastroenteritis", "hemiparesis, myocardial infarction, osteomyelitis", "depressive disorder, thrombocytopaenia", "passed stones, urge incontinence, mass of body structure"
57, 39, M, Two or more races, A+, "aphasia, hepatitis, hypertension pulmonary", "incontinence", "effusion pericardial, gastritis", "psychotic disorder, pneumonia aspiration, transient ischemic attack", "hemiparesis, lymphatic diseases", "", "", "", "", "chill, fatigue, hyperacusis, mass of body structure"
58, 73, M, White, AB+, "tonic-clonic epilepsy", "neutropenia, hernia", "thrombocytopaenia, adenocarcinoma", "stenosis aortic valve", "neoplasm metastasis", "", "dehydration", "ketoacidosis diabetic ", "malignant tumor of colon, hyperlipidemia", "numbness of hand, nonsmoker, pain, general discomfort"
59, 13, F, White, O-, "dependence, migraine disorders", "aphasia", "hernia hiatal", "", "", "", "", "", "", "fever"
60, 80, F, Native American or Alaska Native, B+, "effusion pericardial, affect labile, hepatitis C", "tricuspid valve insufficiency, influenza", "", "delusion, benign prostatic hypertrophy, influenza", "failure heart, melanoma, hyperglycemia", "schizophrenia, hypoglycemia, systemic infection, diverticulitis", "upper respiratory infection", "cellulitis, coronary heart disease", "influenza, accident cerebrovascular, acquired immuno-deficiency syndrome, dehydration, bipolar disorder", "throbbing sensation quality"
61, 51, F, Native American or Alaska Native, B+, "dependence, gastritis", "osteoporosis, exanthema", "migraine disorders, malignant neoplasm of prostate", "neoplasm, septicemia", "influenza, pneumonia", "epilepsy, coronary heart disease, tonic-clonic epilepsy", "influenza, schizophrenia, hypercholesterolemia", "", "", "unable to concentrate, intoxication"
62, 75, M, Black or African American, A-, "respiratory failure", "neoplasm metastasis", "embolism pulmonary", "osteoporosis, pneumonia", "oral candidiasis, malignant neoplasms, systemic infection, acquired immuno-deficiency syndrome", "hiv infections, tricuspid valve insufficiency", "bronchitis, respiratory failure, gout, hepatitis C, insufficiency renal", "acquired immuno-deficiency syndrome, hernia, degenerative polyarthritis, septicemia", "stenosis aortic valve, neoplasm metastasis", "lesion"
63, 23, F, Asian, A+, "neutropenia", "biliary calculus, respiratory failure, arthritis", "fibroid tumor", "failure heart, tonic-clonic epilepsy", "", "", "", "", "", "hyperemesis, pain abdominal, general discomfort"
64, 85, M, Native American or Alaska Native, A+, "pyelonephritis", "hypoglycemia, cellulitis", "glaucoma", "epilepsy, lymphoma, asthma", "infection urinary tract", "", "pericardial effusion body substance, edema pulmonary, degenerative polyarthritis, gastritis", "hypoglycemia, chronic alcoholic intoxication", "biliary calculus, Alzheimer's disease, coronary heart disease", "urgency of micturition, pain abdominal"
65, 12, F, White, AB+, "hypothyroidism, depressive disorder", "hyperlipidemia", "", "", "", "", "", "", "", "constipation"
66, 16, M, Native Hawaiians or Other Pacific Islander, A-, "coronary arteriosclerosis", "dementia, hyperglycemia, gastritis", "arthritis", "", "", "", "", "", "", "breath sounds decreased, haemoptysis, yellow sputum"
67, 8, F, Asian, A-, "colitis, personality disorder", "aphasia, affect labile", "", "", "", "", "", "", "", "prostatism, homelessness, heavy legs, muscle twitch"
68, 42, M, Native Hawaiians or Other Pacific Islander, AB-, "hypothyroidism", "tonic-clonic seizures, edema pulmonary", "influenza, pneumonia aspiration, gout", "oral candidiasis, influenza, dependence", "bronchitis", "pancytopenia, malignant neoplasm of lung, melanoma", "", "", "", "qt interval prolonged, guaiac positive, diarrhea"
69, 13, M, Some other race, AB+, "thrombocytopaenia", "fibroid tumor", "migraine disorders, ileus", "", "", "", "", "", "", "tachypnea, wheezing"
70, 10, M, Native Hawaiians or Other Pacific Islander, AB+, "delirium, hiv infections, manic disorder", "manic disorder, systemic infection", "", "", "", "", "", "", "", "ascites, thicken, mass of body structure, lesion"
71, 26, M, Black or African American, B+, "delirium, lymphatic diseases", "ketoacidosis diabetic , suicide attempt", "migraine disorders, osteomyelitis", "", "", "", "", "", "", "chest discomfort, cardiomegaly"
72, 76, F, Two or more races, B+, "overload fluid, insufficiency renal, hepatitis B", "cellulitis", "delusion, infection", "tachycardia sinus", "osteoporosis, HIV, bipolar disorder", "colitis", "mitral valve insufficiency, lymphatic diseases, delusion", "sickle cell anemia, depression mental, stenosis aortic valve", "hypercholesterolemia, carcinoma prostate, thrombocytopaenia", "formication"
73, 56, F, Black or African American, AB+, "", "malignant neoplasm of prostate", "deglutition disorder, ketoacidosis diabetic ", "degenerative polyarthritis", "malignant neoplasms, neuropathy, stenosis aortic valve", "Alzheimer's disease", "hernia hiatal", "", "", "pruritus, headache"
74, 48, F, Native Hawaiians or Other Pacific Islander, A-, "sickle cell anemia, gout", "adenocarcinoma, asthma", "parkinson disease, pancytopenia", "osteomyelitis", "epilepsy, dependence", "exanthema", "", "", "", "pruritus"
75, 9, F, Black or African American, B+, "hiv infections", "pneumonia aspiration", "", "", "", "", "", "", "", "chill, fever"
76, 56, F, White, AB+, "coronary arteriosclerosis, infection urinary tract", "pyelonephritis", "diverticulitis, neuropathy", "failure kidney, hepatitis C, pneumonia aspiration, mitral valve insufficiency, respiratory failure", "personality disorder", "hypercholesterolemia, Alzheimer's disease", "neoplasm metastasis", "", "", "pain, thicken"
77, 14, M, Asian, B+, "spasm bronchial", "malignant neoplasms", "hypoglycemia", "", "", "", "", "", "", "syncope, lethargy"
78, 7, M, Native Hawaiians or Other Pacific Islander, B-, "paroxysmal dyspnea, adhesion", "kidney disease, dementia, melanoma", "", "", "", "", "", "", "", "ecchymosis"
79, 30, M, Native Hawaiians or Other Pacific Islander, O-, "ileus, gastroesophageal reflux disease", "hernia", "adenocarcinoma", "oral candidiasis", "", "", "", "", "", "transaminitis, superimposition, decreased body weight"
80, 75, F, Native Hawaiians or Other Pacific Islander, O+, "primary malignant neoplasm, hypertension pulmonary, glaucoma", "lymphatic diseases", "personality disorder, dependence", "hypercholesterolemia, neutropenia, gastritis", "hepatitis", "chronic kidney failure, chronic alcoholic intoxication, glaucoma, ulcer peptic, epilepsy, edema pulmonary", "confusion", "neoplasm metastasis", "hypercholesterolemia, chronic obstructive airway disease, influenza", "pericardial friction rub, intoxication, hemodynamically stable"
81, 45, M, Asian, B-, "epilepsy", "obesity, cirrhosis", "hernia", "delusion, bronchitis, malignant neoplasm of prostate", "cholecystitis, confusion, emphysema pulmonary, pancreatitis, colitis", "epilepsy, degenerative polyarthritis, asthma, neoplasm metastasis, hernia hiatal", "", "", "", "painful swallowing, macule"
82, 62, M, Black or African American, B-, "hypothyroidism, kidney disease, influenza", "carcinoma of lung", "", "lymphoma", "influenza, primary carcinoma of the liver cells", "chronic obstructive airway disease, hernia, Alzheimer's disease, hepatitis C", "osteomyelitis, cirrhosis, paranoia", "neutropenia", "", "night sweat, cough"
83, 47, F, Native American or Alaska Native, A+, "gastritis, effusion pericardial", "", "ischemia", "carcinoma breast, infection, kidney failure acute", "degenerative polyarthritis, influenza", "neoplasm metastasis", "", "", "", "night sweat, pain chest, metastatic lesion"
84, 47, F, White, O-, "effusion pericardial, ulcer peptic", "candidiasis, transient ischemic attack", "cholecystitis, pneumonia aspiration", "neoplasm", "hiv infections", "anxiety state", "", "", "", "arthralgia, room spinning, myalgia, behavior showing increased motor activity"
85, 31, M, Some other race, O+, "hepatitis B", "gastritis", "systemic infection, septicemia", "cellulitis, hypercholesterolemia, hepatitis, coronary heart disease", "coronary arteriosclerosis, chronic alcoholic intoxication", "", "", "", "", "hyponatremia, prodrome, pain abdominal"
86, 83, M, Native Hawaiians or Other Pacific Islander, AB+, "pneumothorax", "neoplasm metastasis, hepatitis C, hyperlipidemia", "sickle cell anemia, influenza, exanthema", "failure heart, systemic infection, spasm bronchial", "pneumothorax, personality disorder, gastritis", "insufficiency renal, adhesion, hypothyroidism, pneumonia", "candidiasis, accident cerebrovascular, adenocarcinoma, delusion", "hepatitis, pyelonephritis, Alzheimer's disease", "chronic kidney failure, gout, depressive disorder, hyperglycemia", "numbness, unsteady gait"
87, 42, M, Two or more races, B+, "accident cerebrovascular", "gastritis, neuropathy, pneumonia", "asthma", "", "influenza, hyperlipidemia", "carcinoma of lung", "", "", "", "terrify"
88, 36, M, Asian, O-, "lymphatic diseases, incontinence", "infection", "gout, obesity", "malignant neoplasm of prostate, hiv infections, hepatitis C, suicide attempt, depressive disorder, asthma", "Alzheimer's disease, hemorrhoids, migraine disorders, manic disorder", "", "", "", "", "shortness of breath, vertigo, palpitation"
